mylkldelectric,2017-09-12 14:32,0,1,So I guess south lakeland/highland city area is screwed,,,,9.07673233352163E+017,https://twitter.com/itismysong/status/907673233352163328
mylkldelectric,2017-09-12 13:57,0,0,they only 3 outages report in gibsonia! all houses no power w. Daughtery by 98 +side rds,,,,9.0766449095886E+017,https://twitter.com/VigusDna/status/907664490958860288
mylkldelectric,2017-09-12 13:53,0,1,We know that you are trying hard to restore power. Thanks Lakeland electric. Please hurry. Hard to sleep. Have to work nights.,,,,9.07663460087026E+017,https://twitter.com/SheriGr01988582/status/907663460087025665
mylkldelectric,2017-09-12 13:45,0,1,They are complete rock stars in my book,,,,9.07661377694831E+017,https://twitter.com/CarrriAnnn/status/907661377694830592
mylkldelectric,2017-09-12 13:37,1,4,"Latest numbers in #Lkld is that @mylkldelectric only has just over 28,000 customers without power. A big improvement. @FOX13News",,@mylkldelectric @FOX13News,#Lkld,9.0765945160328E+017,https://twitter.com/LucasBoggPhotog/status/907659451603279872
mylkldelectric,2017-09-12 13:37,0,0,"@mylkldelectric tweet 4 neighbors-East Lk Morton south Osceola still no power. Many have voip phones & Spectrum's out, they can't report it.",,@mylkldelectric,,9.07659345520939E+017,https://twitter.com/CharlesKersey/status/907659345520939013
mylkldelectric,2017-09-12 13:33,0,1,@mylkldelectric our power just came back on and I cannot thank you enough!! THANK YOU!!!!,,@mylkldelectric,,9.07658413085258E+017,https://twitter.com/CarrriAnnn/status/907658413085257728
mylkldelectric,2017-09-12 13:21,0,2,If i have to spend another night with the windows open listening to the neighbor's generator I'm just going to snap...,,,,9.07655509163078E+017,https://twitter.com/Maniakyl/status/907655509163077632
mylkldelectric,2017-09-12 13:13,0,0,@mylkldelectric power is back on at Audubon Oaks in north Lakeland. Thanks for all of your hard work!,,@mylkldelectric,,9.07653517673996E+017,https://twitter.com/highheat208/status/907653517673996288
mylkldelectric,2017-09-12 13:11,0,0,@mylkldelectric Branch on a line behind 4715 S. Florida Ave. at Kristi St. and S. Jordan Ave. No power. pic.twitter.com/dPKw7WJz3y,,@mylkldelectric,,9.07652983340618E+017,https://twitter.com/justclaussen/status/907652983340617728
mylkldelectric,2017-09-12 13:07,0,0,@mylkldelectric 410 E. Palm Drive 33803 pic.twitter.com/97w8MTD8ql,,@mylkldelectric,,9.07651902535545E+017,https://twitter.com/BYOCBChris/status/907651902535544833
mylkldelectric,2017-09-12 12:48,0,0,May Manor Mobile Home Park having no elec is having sewer lift pumps problems,,,,9.07647208983601E+017,https://twitter.com/flmike07734/status/907647208983601152
mylkldelectric,2017-09-12 12:39,0,0,@mylkldelectric Tree on a line at 4505 S. Florida Ave. pic.twitter.com/a8cB34KvxY,,@mylkldelectric,,9.07644934915809E+017,https://twitter.com/justclaussen/status/907644934915809286
mylkldelectric,2017-09-12 12:31,0,0,Does anyone know if power is back on at Audubon Oaks in North Lakeland? @mylkldelectric pic.twitter.com/QoVSDfDkjm,,@mylkldelectric,,9.07642877597164E+017,https://twitter.com/KirilLange/status/907642877597163522
mylkldelectric,2017-09-12 12:11,0,0,@mylkldelectric Ridge Lake Court is still off the grid. Any ETA on operations to restore power?,,@mylkldelectric,,9.07637728443068E+017,https://twitter.com/Shyphlosion/status/907637728443068416
mylkldelectric,2017-09-12 12:04,0,0,"TBH, even if my power doesn't get turned on. Keep working hard, we'll get there. Offer still stands.",,,,9.07635999416742E+017,https://twitter.com/hmcjh/status/907635999416741888
mylkldelectric,2017-09-12 11:57,0,0,"@mylkldelectric if my power gets turned on by end of today, I'll cook everyone responsible a mean southern meal. #nojoke",,@mylkldelectric,#nojoke,9.07634218091643E+017,https://twitter.com/hmcjh/status/907634218091642881
mylkldelectric,2017-09-12 11:48,0,1,Where in Lakeland are you seeing this bc north Lakeland is still a ghost town with no @mylkldelectric trucks or power to be found,,@mylkldelectric,,9.07631942337798E+017,https://twitter.com/mdtedone/status/907631942337798145
mylkldelectric,2017-09-12 11:41,0,0,Still no power. The area around my Park has power but no power for us.,,,,9.07630207120618E+017,https://twitter.com/josh21122112/status/907630207120617473
mylkldelectric,2017-09-12 11:37,0,1,@mylkldelectric Thank you for getting my power back up & running so quickly. #TrueHeroes,,@mylkldelectric,#TrueHeroes,9.07629263632904E+017,https://twitter.com/Jygator1/status/907629263632904192
mylkldelectric,2017-09-12 11:30,0,1,We have been out of power for two days and we are still waiting at Terralargo subdivision.,,,,9.07627425999327E+017,https://twitter.com/ML8178/status/907627425999327232
mylkldelectric,2017-09-12 11:29,0,2,It's big Hans,,,,9.07627355409207E+017,https://twitter.com/MeowItsMila/status/907627355409207296
mylkldelectric,2017-09-12 11:29,0,1,@HansLehman1,,@HansLehman1,,9.07627302011462E+017,https://twitter.com/MeowItsMila/status/907627302011461632
mylkldelectric,2017-09-12 11:24,0,0,Is there an update as to when the Kathleen area is going to get their power back? You have a social media team yet no one responds!,,,,9.07625938455859E+017,https://twitter.com/TerrariaGeckos/status/907625938455859200
mylkldelectric,2017-09-12 11:21,0,1,How about community around Lakeland square mall area? Sleepy Hill Road?,,,,9.07625137876464E+017,https://twitter.com/ML8178/status/907625137876463616
mylkldelectric,2017-09-12 11:15,0,0,Wondering the same thing and I have sent @mylkldelectric a couple messages on Twitter and Facebook asking and no response.,,@mylkldelectric,,9.07623808009478E+017,https://twitter.com/anitademaris/status/907623808009478145
mylkldelectric,2017-09-12 10:44,0,0,At soon Dossey Road is restored I believe that 200+ families will go back to normal,,,,9.07615944083681E+017,https://twitter.com/Torresal1960/status/907615944083681285
mylkldelectric,2017-09-12 10:42,0,0,Please come to north Lakeland. 98 and daughtry.,,,,9.07615429174206E+017,https://twitter.com/SheriGr01988582/status/907615429174206464
mylkldelectric,2017-09-12 10:39,0,0,@mylkldelectric heritage tr needs a fuse thrown at the top of a pole at Coronet and Heritage trail will take 5 min please send a truck,,@mylkldelectric,,9.07614653353808E+017,https://twitter.com/Aajones18/status/907614653353807872
mylkldelectric,2017-09-12 10:37,0,0,Any word on restoration at the Wildwood subdivision and Dossey Road,,,,9.07614249513624E+017,https://twitter.com/Torresal1960/status/907614249513623552
mylkldelectric,2017-09-12 10:29,0,0,@mylkldelectric Are you being assisted in restoration efforts by the mobilized utilities from other states shown on news before storm?,,@mylkldelectric,,9.07612041447342E+017,https://twitter.com/anitademaris/status/907612041447342080
mylkldelectric,2017-09-12 10:26,0,0,id i have trees on powerlines leading to my house should i cut the trees or wait. For yall,,,,9.07611356991553E+017,https://twitter.com/The_Professor8/status/907611356991553537
mylkldelectric,2017-09-12 10:23,0,0,in the Winston /Swindell/Galloway road area I haven't seen a power truck in 2 days is there a reason why? If so would appreciate update,,,,9.07610731289498E+017,https://twitter.com/therealKendallB/status/907610731289497601
mylkldelectric,2017-09-12 10:23,0,0,"At soon Dossey Road is restored, I believe that 200+ families will go back to normal.",,,,9.0761068859981E+017,https://twitter.com/Torresal1960/status/907610688599810050
mylkldelectric,2017-09-12 10:22,0,2,Thank you Thank you Thank you!!!!!!!!!!!!!!!!!!,,,,9.07610361486102E+017,https://twitter.com/stacielee1313/status/907610361486102528
mylkldelectric,2017-09-12 10:20,0,0,@mylkldelectric THANK YOU for getting my power back on! #LinemenRock #soverythankful,,@mylkldelectric,#LinemenRock #soverythankful,9.076098198504E+017,https://twitter.com/FlStokes/status/907609819850399744
mylkldelectric,2017-09-12 10:13,0,3,Crews are being dispatched.,,,,9.07608225696154E+017,https://twitter.com/lakelandgov/status/907608225696153602
mylkldelectric,2017-09-12 10:11,0,1,Thank you Lkld Electric! pic.twitter.com/s9z7A4DS7w,,,,9.07607488039674E+017,https://twitter.com/Trekkerlady329/status/907607488039673857
mylkldelectric,2017-09-12 10:08,0,0,@mylkldelectric is there anyway to help/ volunteer in any way ?,,@mylkldelectric,,9.07606858315256E+017,https://twitter.com/Heathscott10/status/907606858315255808
mylkldelectric,2017-09-12 10:00,0,0,Thank you so much for all you're doing!! Please tell all the workers to be safe!!,,,,9.07604903014621E+017,https://twitter.com/sethmckeel/status/907604903014621185
mylkldelectric,2017-09-12 09:59,0,1,Plz provide link fir map to check areas still without power. Tnks.,,,,9.076045872507E+017,https://twitter.com/skip30/status/907604587250700288
mylkldelectric,2017-09-12 09:56,0,1,"If @mylkldelectric keeps kicking ass, we won't have to post pone our Farmers Market Show again! #CURBcouture #lkld #lovelakeland #killinit",,@mylkldelectric,#CURBcouture #lkld #lovelakeland #killinit,9.07603945278857E+017,https://twitter.com/lkldLOOKBOOK/status/907603945278857216
mylkldelectric,2017-09-12 09:53,0,0,Roughly where this arrow is pic.twitter.com/8wRaljiRII,,,,9.07603005649944E+017,https://twitter.com/stacielee1313/status/907603005649944576
mylkldelectric,2017-09-12 09:50,0,0,S dossey rd & Pipkin - west of Florida,,,,9.07602363145494E+017,https://twitter.com/stacielee1313/status/907602363145494528
mylkldelectric,2017-09-12 09:45,0,1,Love you guys!!! Stay safe and God Bless,,,,9.07601039041409E+017,https://twitter.com/mfrancis809/status/907601039041409024
mylkldelectric,2017-09-12 09:43,0,1,Why am I the only house in my neighborhood without power?!? @mylkldelectric,,@mylkldelectric,,9.07600615274156E+017,https://twitter.com/ColeJohn_/status/907600615274156037
mylkldelectric,2017-09-12 09:35,0,0,I believe that at soon Dossey Road is restored 200 + families will go back to normal.,,,,9.07598595632894E+017,https://twitter.com/Torresal1960/status/907598595632893954
mylkldelectric,2017-09-12 09:34,0,0,Hi can you able to tell me if the power is back already in 1108 bartow road (off S 98) 33801?,,,,9.07598219605168E+017,https://twitter.com/reinmaniquiz/status/907598219605168129
mylkldelectric,2017-09-12 09:32,0,2,What is the nearest intersection?,,,,9.07597775906492E+017,https://twitter.com/lakelandgov/status/907597775906492417
mylkldelectric,2017-09-12 09:32,0,0,"I know you guys are doing your best,and I thank you for it. Apparently Dossey Road and Wildwood Subdivision are on the same grid line.",,,,9.07597684382605E+017,https://twitter.com/Torresal1960/status/907597684382605312
mylkldelectric,2017-09-12 09:31,0,0,@mylkldelectric how many more days it's gone take to get the power on?,,@mylkldelectric,,9.07597532091613E+017,https://twitter.com/_MyiaB/status/907597532091613184
mylkldelectric,2017-09-12 09:29,1,8,When power comes back on it's like hitting a game winner in triple OT ... @mylkldelectric for the WINNN #hurricaneIrma #prayforflorida pic.twitter.com/l51lPYMlb0,,@mylkldelectric,#hurricaneIrma #prayforflorida,9.07596916032246E+017,https://twitter.com/CoachRjayBarsh/status/907596916032245761
mylkldelectric,2017-09-12 09:27,0,2,We need power in North Lakeland!!!!!!!,,,,9.07596604475134E+017,https://twitter.com/FLAeagle777/status/907596604475133952
mylkldelectric,2017-09-12 09:15,0,0,Please help us! No power & trapped in our neighborhood! This is laying on s Dossey Rd -TRAPPED! Only rd into the neighborhood blocked pic.twitter.com/VZmjvtrG22,,,,9.07593425507242E+017,https://twitter.com/stacielee1313/status/907593425507241989
mylkldelectric,2017-09-12 09:13,0,0,Pollack near Hallam Dr. Is dark. Any idea when power will be restored? Please provide an update.,,,,9.07593072984384E+017,https://twitter.com/SEU_Online/status/907593072984383490
mylkldelectric,2017-09-12 09:11,0,1,Please help s dossey rd - no power and trapped in the neighborhood! We can't even get anywhere else! pic.twitter.com/Yop09C70Z3,,,,9.07592528303665E+017,https://twitter.com/stacielee1313/status/907592528303665152
mylkldelectric,2017-09-12 09:10,0,1,Know u r working hard. Any eta on Wabash George Jenkins area? Thx 4 all you r doing,,,,9.07592375291302E+017,https://twitter.com/Sharmin_Hibbert/status/907592375291301888
mylkldelectric,2017-09-12 09:07,0,0,S Lkld Tillery Road east off of Clubhouse has a power pole that has burned thru and is smoldering.,,,,9.07591559440466E+017,https://twitter.com/Trekkerlady329/status/907591559440465921
mylkldelectric,2017-09-12 08:59,2,8,"@mylkldelectric linemen doing a yeoman's job. Height of storm had 78K w/o power. Down to 46K. Mutual aid from NC, OK & LA on the way. #lkld pic.twitter.com/1yMIhYDpH3",,@mylkldelectric,#lkld,9.07589452817629E+017,https://twitter.com/lakelandgov/status/907589452817629185
mylkldelectric,2017-09-12 08:59,0,5,North Lakeland is a ghost town.... Please help!!,,,,9.0758937406124E+017,https://twitter.com/RankingWebPages/status/907589374061240320
mylkldelectric,2017-09-12 08:43,0,0,"Sorry but I hope that's right, I live off of lake Hollingsworth.",,,,9.07585353338556E+017,https://twitter.com/SydnaCrux/status/907585353338556417
mylkldelectric,2017-09-12 08:40,0,0,,,,,9.07584771353653E+017,https://twitter.com/woman_on_a_rant/status/907584771353653248
mylkldelectric,2017-09-12 08:21,0,0,@mylkldelectric any idea when the Lakeland Christina area will get power? Seems everyone around us is up already. Thank u,,@mylkldelectric,,9.07580013909877E+017,https://twitter.com/Crampa6/status/907580013909876737
mylkldelectric,2017-09-12 08:20,0,0,We had power up until sometime last night. What happened? When will it be working again?,,,,9.07579702549864E+017,https://twitter.com/turn_to_ash/status/907579702549864448
mylkldelectric,2017-09-12 08:16,0,1,My best friend lives in Lakeland. I visited several years ago. Beautiful city. Thank you for all you're doing to make it safe again!,,,,9.07578782445392E+017,https://twitter.com/PamD63/status/907578782445391872
mylkldelectric,2017-09-12 07:56,0,1,Thanks to all you guys. I'm fully confident you'll get us back online as soon as you can.,,,,9.07573604333834E+017,https://twitter.com/BobTreemore/status/907573604333834241
mylkldelectric,2017-09-12 07:50,0,0,When you are home after @hurricaneIrma and have no power no school @mylkldelectric pic.twitter.com/tk9yKEKEgi,,@hurricaneIrma @mylkldelectric,,9.07572170041303E+017,https://twitter.com/therealKendallB/status/907572170041303040
mylkldelectric,2017-09-12 07:42,0,1,@mylkldelectric I'm trying to be patient but my OCD is kicking in! Hope this section of S. Florida Ave gets power today. Thank you line men!,,@mylkldelectric,,9.07570196466028E+017,https://twitter.com/FlStokes/status/907570196466028544
mylkldelectric,2017-09-12 07:40,0,0,@mylkldelectric just watched my wife bump around in dark getting ready 4 work fortunately I'm off/nt comfortable leaving kids home w/o pwr,,@mylkldelectric,,9.07569591823594E+017,https://twitter.com/therealKendallB/status/907569591823593474
mylkldelectric,2017-09-12 07:38,0,1,Yaaaaayyyy!! Thanks everyone!,,,,9.07569032743834E+017,https://twitter.com/SydnaCrux/status/907569032743833602
mylkldelectric,2017-09-12 07:31,12,47,Our team w/ @lakelandgov @LakelandFD @mylkldelectric already at it this morning for restoration efforts pic.twitter.com/jKZYlQzrk8,,@lakelandgov @LakelandFD @mylkldelectric,,9.07567248105247E+017,https://twitter.com/LakelandPD/status/907567248105246720
mylkldelectric,2017-09-12 07:25,0,0,@mylkldelectric any idea when east clubhouse Rd might get power,,@mylkldelectric,,9.07565889523987E+017,https://twitter.com/JrainkT/status/907565889523986432
mylkldelectric,2017-09-12 06:32,0,0,"@mylkldelectric Looks like some underground cables were exposed. Pls check out at your earliest, no power. Winding Vine Drive. pic.twitter.com/GUeNOtfQYp",,@mylkldelectric,,9.07552488353649E+017,https://twitter.com/Bigk76zx14/status/907552488353648640
mylkldelectric,2017-09-12 06:31,0,1,If you live in Florida....a generator and a gas grill are 2 must have items....,,,,9.07552355515806E+017,https://twitter.com/Billyw1947/status/907552355515805696
mylkldelectric,2017-09-12 05:15,1,1,Literally my mood right now! @mylkldelectric https:// twitter.com/godspolitician /status/907531450068738048 …,,@mylkldelectric,,9.07533145007956E+017,https://twitter.com/sarahjeannxo/status/907533145007955968
mylkldelectric,2017-09-12 03:03,0,0,@mylkldelectric when will you guys be restoring N. Lakeland side of the power outage?,,@mylkldelectric,,9.07499806196732E+017,https://twitter.com/anika______/status/907499806196731904
mylkldelectric,2017-09-12 02:56,0,0,Neighbor's tree in backyard on power line. pic.twitter.com/uQIgbUzkrS,,,,9.07498135257321E+017,https://twitter.com/terribeartaz/status/907498135257321472
mylkldelectric,2017-09-12 01:21,0,0,@mylkldelectric how come other apartment buildings @ariva have power but we don't? My dog is panting uncontrollably without the AC,,@mylkldelectric @ariva,,9.07474289716318E+017,https://twitter.com/123ashmarie/status/907474289716318208
mylkldelectric,2017-09-12 00:36,0,0,So think we will get power back over near the Lakeland Square Mall before I melt from the heat?,,,,9.07462849362104E+017,https://twitter.com/mdtedone/status/907462849362104320
mylkldelectric,2017-09-12 00:33,0,0,Hopefully the light will shine on you again soon!,,,,9.0746226876964E+017,https://twitter.com/TheStormologist/status/907462268769640448
mylkldelectric,2017-09-12 00:29,0,1,Everybody is getting their power back and I pull up to the darkest of complexes thanks @mylkldelectric #Irma #lakelandelectric #gimmepower,,@mylkldelectric,#Irma #lakelandelectric #gimmepower,9.07461197271851E+017,https://twitter.com/mdtedone/status/907461197271851008
mylkldelectric,2017-09-12 00:26,0,0,But hey can we get some electricity back here- been out over 36 hours,,,,9.07460452036293E+017,https://twitter.com/mdtedone/status/907460452036292609
mylkldelectric,2017-09-12 00:23,0,0,Sorry but it's Florida - there should be 24 hr shifts after a storm to restore power @mylkldelectric we are gonna melt!,,@mylkldelectric,,9.07459581005242E+017,https://twitter.com/mdtedone/status/907459581005242368
mylkldelectric,2017-09-12 00:05,0,0,all of westlake apartments is out of power,,,,9.07455162180162E+017,https://twitter.com/Jominicano/status/907455162180161536
mylkldelectric,2017-09-12 00:05,0,0,@mylkldelectric all of westlake apartments is out of power,,@mylkldelectric,,9.07455109101224E+017,https://twitter.com/Jominicano/status/907455109101223936
mylkldelectric,2017-09-11 23:41,0,0,@mylkldelectric thank you for your hard work in restoring our family's power after irma https:// twitter.com/lakelandgov/st atus/907251717649072129 …,,@mylkldelectric,,9.07449182780261E+017,https://twitter.com/Lupe_Barrera/status/907449182780260353
mylkldelectric,2017-09-11 23:36,0,0,"Whay before the hurricane struck. Where can I call for help. 2 family's, children with asthma and older persons.",,,,9.07447756280746E+017,https://twitter.com/Camachospr/status/907447756280745984
mylkldelectric,2017-09-11 23:36,0,0,@mylkldelectric yo,,@mylkldelectric,,9.07447690111447E+017,https://twitter.com/I_AMWEBB/status/907447690111447040
mylkldelectric,2017-09-11 23:34,0,0,"Part 2 Something much easier to deal with than down post, trees or lines. Going two days, reported at 7:39PM on the 10th.",,,,9.07447280843751E+017,https://twitter.com/Camachospr/status/907447280843751425
mylkldelectric,2017-09-11 23:33,0,0,On my block we are the two houses without electricity because a fuse or link. When the two lines touched during some winds.,,,,9.07447043177804E+017,https://twitter.com/Camachospr/status/907447043177803781
mylkldelectric,2017-09-11 23:29,0,0,Thank you so much! We love you!,,,,9.07446105050419E+017,https://twitter.com/arthurwrightis/status/907446105050419205
mylkldelectric,2017-09-11 22:36,0,1,Power restoration north Kathleen eta asap,,,,9.07432723094098E+017,https://twitter.com/ASrillings/status/907432723094097921
mylkldelectric,2017-09-11 22:29,0,0,Up to 2 weeks https:// m.facebook.com/MyLakelandElec tric/photos/a.136056106565071.1073741838.135878163249532/660199114150765/?type=3&theater …,,,,9.0743094664278E+017,https://twitter.com/21untilidie/status/907430946642780160
mylkldelectric,2017-09-11 22:27,0,0,@mylkldelectric some power poles and lines snapped during #hurricaneimra . pic.twitter.com/dn9xxw353g,,@mylkldelectric,#hurricaneimra,9.07430426276504E+017,https://twitter.com/jdfknight21/status/907430426276503552
mylkldelectric,2017-09-11 21:41,0,2,Do we have an ETA on power restoration?,,,,9.07418937662562E+017,https://twitter.com/DawnMalkowski/status/907418937662562304
mylkldelectric,2017-09-11 21:41,0,0,Do we have any ETA on power restoration?,,,,9.0741878204133E+017,https://twitter.com/DawnMalkowski/status/907418782041329669
mylkldelectric,2017-09-11 21:34,0,0,Same here!,,,,9.07417130911625E+017,https://twitter.com/Torresal1960/status/907417130911625217
mylkldelectric,2017-09-11 21:32,0,0,Ralph Rd has a line down from a tree that fell. And residents just tried it to another tree. #idiots #HurricaneIrma,,,#idiots #HurricaneIrma,9.07416586314818E+017,https://twitter.com/Jessica01591861/status/907416586314817536
mylkldelectric,2017-09-11 21:30,0,0,Any updates for the Wildwood subdivision,,,,9.07416105039298E+017,https://twitter.com/Torresal1960/status/907416105039298560
mylkldelectric,2017-09-11 21:27,0,0,Lighting all candles &hoping @mylkldelectric can get power on fast.Shout out to the linemen working their butts off! Thanx #hurricaneimra pic.twitter.com/pWfieB64bQ,,@mylkldelectric,#hurricaneimra,9.07415352388223E+017,https://twitter.com/HollyBelle15/status/907415352388222977
mylkldelectric,2017-09-11 21:26,0,0,Thanks & be safe !,,,,9.07415142027207E+017,https://twitter.com/DanDanfwagner/status/907415142027206656
mylkldelectric,2017-09-11 21:25,0,1,"Y'ALL close ?! We need electricity and been without for 25 hours, I have no time to play @mylkldelectric",,@mylkldelectric,,9.07414777772872E+017,https://twitter.com/4everaniya/status/907414777772871682
mylkldelectric,2017-09-11 21:23,0,1,East Edgewood is entitely out of power especially 1920 east Edgewood,,,,9.07414210207941E+017,https://twitter.com/EvanC37402795/status/907414210207940608
mylkldelectric,2017-09-11 21:21,0,0,". @mylkldelectric how is it that the other 15 buildings in my complex have/had power for hours and mine doesn't? It's 86 in here, cmon now",,@mylkldelectric,,9.07413861527167E+017,https://twitter.com/alldaydanforth/status/907413861527166984
mylkldelectric,2017-09-11 21:08,0,1,@mylkldelectric @lakelandgov this is making it impossible for me to even get out of my neighborhood s dossey rd (2) pic.twitter.com/ZqzX2zDTas,,@mylkldelectric @lakelandgov,,9.07410499008123E+017,https://twitter.com/stacielee1313/status/907410499008122881
mylkldelectric,2017-09-11 21:07,0,0,@mylkldelectric couldn't get through on the phone so I hope you are aware of this on s Dossey re - power lines down @lakelandgov (1) pic.twitter.com/xZseAXpVJA,,@mylkldelectric @lakelandgov,,9.07410261161775E+017,https://twitter.com/stacielee1313/status/907410261161775104
mylkldelectric,2017-09-11 21:04,0,1,"Hurricane Irma had winds almost 100mph in Lakeland, FL. Power lost at 11:45 PM. Restored by @mylkldelectric within 24 hours. yeaaaa!",,@mylkldelectric,,9.07409544657162E+017,https://twitter.com/Abella67/status/907409544657162241
mylkldelectric,2017-09-11 20:50,0,2,@mylkldelectric Thank you for restoring power to our complex so quickly #AfterIrma ! Sending strength to all as you continue your work.,,@mylkldelectric,#AfterIrma,9.07406140065157E+017,https://twitter.com/heyShaye/status/907406140065157120
mylkldelectric,2017-09-11 20:48,0,1,@mylkldelectric any ETA on when we'll get power back at Walt Williams rd? Need to do something with food if it's gonna be days not hours,,@mylkldelectric,,9.07405480108204E+017,https://twitter.com/mhall119/status/907405480108204032
mylkldelectric,2017-09-11 20:47,0,0,Are you guys going to sent the usual power restoration notifications when it's restored? @lakelandgov,,@lakelandgov,,9.07405171734577E+017,https://twitter.com/Guy_Martineau/status/907405171734577153
mylkldelectric,2017-09-11 20:44,0,0,Thank you for the power & of course Hard Work.,,,,9.07404613187506E+017,https://twitter.com/Dlkramper/status/907404613187506181
mylkldelectric,2017-09-11 20:44,1,1,@mylkldelectric Power enabled after Hurricane Irma within 24 hours. Thanks Lakeland Electric. Good job!!!!,,@mylkldelectric,,9.07404593096786E+017,https://twitter.com/Abella67/status/907404593096785920
mylkldelectric,2017-09-11 20:33,0,0,I am one of the 68000 people sitting in the dark going on 24 hours already/sorry if I'm not excited,,,,9.07401837212525E+017,https://twitter.com/therealKendallB/status/907401837212524544
mylkldelectric,2017-09-11 20:27,0,0,@mylkldelectric hats off to the amazing men & women out there today. Our power is restored. Cranky kids no more!great job out there today.,,@mylkldelectric,,9.07400346305274E+017,https://twitter.com/pattylovespink/status/907400346305273857
mylkldelectric,2017-09-11 20:27,0,2,"""Dear . @mylkldelectric would U please TurnOn all Xbox's in Lakeland!!! Thank U for all your good work."" J.B. 5yrs old; South McKeel Academy. pic.twitter.com/G66OUrpvLN",,@mylkldelectric,,9.07400209440834E+017,https://twitter.com/JerryMorton/status/907400209440833536
mylkldelectric,2017-09-11 20:15,0,0,"No problem, I hope you get your power back soon. Stay strong!",,,,9.07397129068565E+017,https://twitter.com/SusmariosepAnak/status/907397129068564485
mylkldelectric,2017-09-11 20:08,0,0,Neighborhood right behind Valleyview Elementary school!,,,,9.07395433529594E+017,https://twitter.com/SusmariosepAnak/status/907395433529593856
