mylkldelectric,2017-09-14 15:31,1,2,All the power companies are telling everyone late Sunday because they all don't know what the fuck they're doing. It's criminal.,,,,9.08412896476062E+017,https://twitter.com/ScottGrovesCO/status/908412896476061702
mylkldelectric,2017-09-14 15:30,0,0,"Umm, teco is telling us we have no power till 11:45 Sunday or beyond.",,,,9.08412584394707E+017,https://twitter.com/ScottGrovesCO/status/908412584394706946
mylkldelectric,2017-09-14 15:28,0,0,Hey what gives. We had power for two days and now it's off?,,,,9.08412261772952E+017,https://twitter.com/soundartxdesign/status/908412261772951558
mylkldelectric,2017-09-14 15:27,1,3,How can teco have all of tampa up and running by Friday night but you can't get Lakeland up and running?,,,,9.08412019694559E+017,https://twitter.com/YGScreech/status/908412019694559232
mylkldelectric,2017-09-14 15:27,0,0,@mylkldelectric we had power for the past 2 days and now it went out again- what happened? Ur phone is down so I can't report it,,@mylkldelectric,,9.08411779772019E+017,https://twitter.com/mdtedone/status/908411779772018688
mylkldelectric,2017-09-14 15:26,0,0,@mylkldelectric our power is out again at Audubon Oaks apartments.,,@mylkldelectric,,9.08411604240359E+017,https://twitter.com/highheat208/status/908411604240359426
mylkldelectric,2017-09-14 15:21,0,0,@mylkldelectric hey we had power and it just went out. Is there a way to see what's going on or something? have babies who need to keep cool,,@mylkldelectric,,9.08410299887313E+017,https://twitter.com/soundartxdesign/status/908410299887312898
mylkldelectric,2017-09-14 15:18,1,0,"Frustrated here as well, keep telling me there's no outage in my area pffft",,,,9.0840965643069E+017,https://twitter.com/foxfoxx3/status/908409656430690304
mylkldelectric,2017-09-14 15:04,1,1,"@mylkldelectric thank you for working late to restore power, our area had power restored last night @10pm #irma #IrmaRecovery #IrmaCleanUp",,@mylkldelectric @10pm,#irma #IrmaRecovery #IrmaCleanUp,9.0840601952462E+017,https://twitter.com/VigusDna/status/908406019524620288
mylkldelectric,2017-09-14 15:00,2,2,@lakelandgov ’s afternoon update lists nine @mylkldelectric “big rebuilding jobs” and says there are still dozens of restorations jobs. #lkld pic.twitter.com/U5cMjyyRoU,,@lakelandgov @mylkldelectric,#lkld,9.08405057716195E+017,https://twitter.com/lkldnow/status/908405057716195333
mylkldelectric,2017-09-14 14:59,0,2,"That they are.. got faith in em, at least the rain has he off since storm. #LakelandStrong",,,#LakelandStrong,9.08404872927678E+017,https://twitter.com/b24cc4b304fd432/status/908404872927678469
mylkldelectric,2017-09-14 14:40,0,0,Any eta on susan drive? One side of the street has power & all around us has it just one side of susan is out still,,,,9.08400171788075E+017,https://twitter.com/ZanetteMcCoy/status/908400171788075008
mylkldelectric,2017-09-14 14:38,0,0,@mylkldelectric is doing a great job to restore power and won't stop until everyone is back on! #PublicPower #FLPublicPower https:// twitter.com/mylkldelectric /status/908381903660646400 …,,@mylkldelectric,#PublicPower #FLPublicPower,9.08399483955896E+017,https://twitter.com/flpublicpower/status/908399483955896322
mylkldelectric,2017-09-14 14:28,0,0,Thank you for all that you've been doing.,,,,9.08397127545578E+017,https://twitter.com/sxpnce/status/908397127545577472
mylkldelectric,2017-09-14 14:13,0,0,between 1 day and 2 weeks???,,,,9.08393243737457E+017,https://twitter.com/rockthenight75/status/908393243737456640
mylkldelectric,2017-09-14 13:51,0,0,Thank you @mylkldelectric for getting our power back on today!,,@mylkldelectric,,9.08387748654056E+017,https://twitter.com/Streamer_House/status/908387748654055426
mylkldelectric,2017-09-14 13:41,0,0,"@mylkldelectric outage map is back online. Duff Road, Reynolds Road zones show the highest outages. https:// lakelandelectric.com/emergency-info rmation-center … #lkld #irmalkld pic.twitter.com/49ilVy3mvT",,@mylkldelectric,#lkld #irmalkld,9.08385137829786E+017,https://twitter.com/lkldnow/status/908385137829785600
mylkldelectric,2017-09-14 13:37,0,0,Finally management makes a minimal effort of providing us some guidance. My god I hope they lead with more enthusiasm.,,,,9.08384173211177E+017,https://twitter.com/Skykingrgc/status/908384173211176960
mylkldelectric,2017-09-14 13:33,1,0,LIAR 844-IRMA and YOUR Rep. Said 2 weeks for this area. N1,,,,9.08383336242053E+017,https://twitter.com/justah_voice/status/908383336242053126
mylkldelectric,2017-09-14 13:28,0,0,Fuck @mylkldelectric !!! AreA N1 BOYCOTT YA LIGHT BILL!!!!!!! 2 WEEKS UNTIL POWER WILL BE RESTORED. CALL 844-IRMA and see,,@mylkldelectric,,9.08382035227632E+017,https://twitter.com/justah_voice/status/908382035227631616
mylkldelectric,2017-09-14 13:18,0,0,@mylkldelectric @LakelandPD @lakelandgov @LakelandPIO if no body is stealing or killing you don't care about Area N1. Or Unless a bill due,,@mylkldelectric @LakelandPD @lakelandgov @LakelandPIO,,9.08379413259194E+017,https://twitter.com/justah_voice/status/908379413259194368
mylkldelectric,2017-09-14 13:15,0,0,@MyLakelandElectric can you please advise?,,@MyLakelandElectric,,9.08378570917106E+017,https://twitter.com/LakelandPD/status/908378570917105669
mylkldelectric,2017-09-14 13:04,0,1,No doubt all supervisors and below are working hard to help. Why dud management not request help sooner and why not give us a timeframe?,,,,9.0837592527179E+017,https://twitter.com/Skykingrgc/status/908375925271789569
mylkldelectric,2017-09-14 13:01,0,0,@mylkldelectric especially here at 4360 Summer Landing Dr.,,@mylkldelectric,,9.08375197622862E+017,https://twitter.com/G_Mack73/status/908375197622861824
mylkldelectric,2017-09-14 13:01,0,0,@mylkldelectric I want to thank everyone at Lakeland Electric for working so hard after the hurricane to get the electricity back on.,,@mylkldelectric,,9.0837503684266E+017,https://twitter.com/G_Mack73/status/908375036842659840
mylkldelectric,2017-09-14 12:59,1,0,Neighbor reported outage called back next day. Was told Oh we thought you had power. Will add you back to the list. Not a faith builder,,,,9.08374753437733E+017,https://twitter.com/Chewtoy_/status/908374753437732864
mylkldelectric,2017-09-14 12:32,0,0,Thank you @mylkldelectric for your efforts in getting the power back on!!!,,@mylkldelectric,,9.08367806445613E+017,https://twitter.com/_abels/status/908367806445613056
mylkldelectric,2017-09-14 12:25,0,1,@LafUtilities is on the move again! Done at @COTNews and headed to @mylkldelectric ! You guys rock! Thank you! #PublicPower https:// twitter.com/LafUtilities/s tatus/908364243631837184 …,,@LafUtilities @COTNews @mylkldelectric,#PublicPower,9.08366006992687E+017,https://twitter.com/flpublicpower/status/908366006992687104
mylkldelectric,2017-09-14 12:20,0,0,but I bet electric bills are still coming out. I bet y'all are going to have some type of error where you hike the bill up,,,,9.08364940146352E+017,https://twitter.com/justah_voice/status/908364940146352128
mylkldelectric,2017-09-14 12:19,0,0,"How about 1108 S Rd 98,33801 (Bartow Rd) any update?",,,,9.08364591331254E+017,https://twitter.com/reinmaniquiz/status/908364591331254272
mylkldelectric,2017-09-14 12:18,2,6,Our crews are on the road to help @mylkldelectric this morning! #linemanstrong #MutualAid #publicpower pic.twitter.com/3ZvATzJkeR,,@mylkldelectric,#linemanstrong #MutualAid #publicpower,9.08364243631837E+017,https://twitter.com/LafUtilities/status/908364243631837184
mylkldelectric,2017-09-14 12:15,0,1,they won't admit that they shut power off after the hurricane. The more you lose with no power. The more you spend money,,,,9.08363563009372E+017,https://twitter.com/justah_voice/status/908363563009372160
mylkldelectric,2017-09-14 12:09,0,0,"How about 1108 S Rd 98,33801 (Bartow Rd) any update?",,,,9.08362087797272E+017,https://twitter.com/reinmaniquiz/status/908362087797272582
mylkldelectric,2017-09-14 12:04,0,0,"Where does crystal lake falls in, had power throughout hurricane, disruption after hurricane",,,,9.08360714896671E+017,https://twitter.com/fiahkris/status/908360714896670723
mylkldelectric,2017-09-14 11:58,0,0,Instead of asking when maybe someone could at least say why.. 1021 Clearview Ave.. Lake Hollingsworth Area,,,,9.08359235003716E+017,https://twitter.com/AmyLynnPage2/status/908359235003715590
mylkldelectric,2017-09-14 11:55,0,0,Losing hundreds of $/day because I run a home business plus a 5 yr old and all of our food is rotten & all we get is tomorrow OR next WEEK??,,,,9.08358607007339E+017,https://twitter.com/MelissaMoranVO/status/908358607007338498
mylkldelectric,2017-09-14 11:29,0,0,"Yes we have a tree down on medulla road , has been down with power line in the road",,,,9.08351918006776E+017,https://twitter.com/bettyj88/status/908351918006775808
mylkldelectric,2017-09-14 11:26,0,0,"I live in a poor area so we are alway last, not enough money here",,,,9.08351194942374E+017,https://twitter.com/bettyj88/status/908351194942373889
mylkldelectric,2017-09-14 11:19,0,0,Did management not have a proper disaster recovery plan? Did they fail to request additional resources in a timely manner? Are they lost?,,,,9.08349402917556E+017,https://twitter.com/Skykingrgc/status/908349402917556224
mylkldelectric,2017-09-14 11:16,0,0,Yup! I live in that neighborhood and without power for now 5 days. Today was the first time we saw a LE truck. Didn't stop here!,,,,9.08348755237274E+017,https://twitter.com/MelissaMoranVO/status/908348755237273602
mylkldelectric,2017-09-14 11:13,0,0,"So the heck wirh specific timelines, can management not provide the expected day our power should be restored. Looks like chaos rules at LE",,,,9.08348069141459E+017,https://twitter.com/Skykingrgc/status/908348069141458944
mylkldelectric,2017-09-14 10:55,1,0,Thank you all for the hard work!,,,,9.08343397659882E+017,https://twitter.com/Lindquist2010/status/908343397659881475
mylkldelectric,2017-09-14 10:40,1,3,"Being on my hooks is not much fun in the cold, I imagine it's worse in the heat and humidity, and I bet the boys are working 12's too pic.twitter.com/k0EpxTMV0b",,,,9.08339800788177E+017,https://twitter.com/TuckerBradly/status/908339800788176896
mylkldelectric,2017-09-14 10:26,0,0,That's encouraging.... @mylkldelectric any eta on it being back up? #HurricaneIrmaRecovery pic.twitter.com/13yTBLKj1s,,@mylkldelectric,#HurricaneIrmaRecovery,9.08336060568146E+017,https://twitter.com/ivyadrena/status/908336060568145920
mylkldelectric,2017-09-14 10:25,0,4,"I understand many of you are angry about not having power, but some of these lineman don't have power at their homes either. Try 2b patient",,,,9.08335986630971E+017,https://twitter.com/CarrriAnnn/status/908335986630971392
mylkldelectric,2017-09-14 10:23,0,0,Thanks to @mylkldelectric for the updates and extremely hard work to bring power back to our city! https:// twitter.com/mylkldelectric /status/908107863503065089 …,,@mylkldelectric,,9.08335282180821E+017,https://twitter.com/micledford/status/908335282180820992
mylkldelectric,2017-09-14 10:17,0,0,(4) We throw $1000 value of food still don't know when will get power. LET'S BE HONEST WITH US AT LEAST WE CAN PLAN ACCORDINGLY.,,,,9.08333768863253E+017,https://twitter.com/sibel_alpar/status/908333768863252485
mylkldelectric,2017-09-14 10:15,0,0,(3)Please be honest so we can plan accordingly. We have relative in Miami and company even given time frame for repair with in hour time.,,,,9.08333507302306E+017,https://twitter.com/sibel_alpar/status/908333507302305793
mylkldelectric,2017-09-14 10:15,0,0,(2) clear picture. Each time we called answer is, between 1 day to two week. I guess this is the worst answer you could give your costumer.,,,9.08333507302306E+017,https://twitter.com/sibel_alpar/status/1
mylkldelectric,2017-09-14 10:14,0,0,(1)As much as we appreciated linemen hard work but communication in costumer service is horrible. This is already day 5 we still don't have,,,,9.08333080175415E+017,https://twitter.com/sibel_alpar/status/908333080175415297
mylkldelectric,2017-09-14 10:12,0,0,What about those on a well we don't even have running water!! Polk city area,,,,9.08332733696442E+017,https://twitter.com/dhkmo4/status/908332733696442368
mylkldelectric,2017-09-14 10:10,0,0,(4) We throw $1000 value of food still don't know when will get power. LET'S BE HONEST WITH US AT LEAST WE CAN PLAN ACCORDINGLY,,,,9.08332231978111E+017,https://twitter.com/sibel_alpar/status/908332231978110976
mylkldelectric,2017-09-14 10:09,0,0,(3)Please be honest so we can plan accordingly. We have relative in Miami and company even given time frame for repair with in hour time.,,,,9.08331862086615E+017,https://twitter.com/sibel_alpar/status/908331862086615041
mylkldelectric,2017-09-14 10:08,0,0,(2) clear picture. Each time we called answer is, between 1 day to two week. I guess this is the worst answer you could give your costumer.,,,9.08331862086615E+017,https://twitter.com/sibel_alpar/status/1
mylkldelectric,2017-09-14 10:07,0,0,(1)As much as we appreciated linemen hard work but communication in costumer service is horrible. This is already day 5 we still don't have,,,,9.08331425581158E+017,https://twitter.com/sibel_alpar/status/908331425581158400
mylkldelectric,2017-09-14 09:57,0,0,Then they disconnected at 9:44 Monday claiming restoration ASAP. STILL WAITING,,,,9.08328926568702E+017,https://twitter.com/fiahkris/status/908328926568701958
mylkldelectric,2017-09-14 09:56,0,0,"@mylkldelectric claims power is restored on my street but I'm still in darkness, no fallen trees or lines, had power throughout storm",,@mylkldelectric,,9.08328517720474E+017,https://twitter.com/fiahkris/status/908328517720473601
mylkldelectric,2017-09-14 09:45,0,0,"Combee by Canal Drive, we have a blow transformer . Eta?",,,,9.08325820728476E+017,https://twitter.com/augustca1984/status/908325820728475648
mylkldelectric,2017-09-14 09:36,0,0,Great news! Thanks for the support. We appreciate it. :),,,,9.08323565614911E+017,https://twitter.com/LakelandPD/status/908323565614911489
mylkldelectric,2017-09-14 09:35,5,13,Outage Update from @mylkldelectric . THANK YOU to all the brave men and women working hard to get power restored! https:// twitter.com/mylkldelectric /status/908107863503065089 …,,@mylkldelectric,,9.08323341521564E+017,https://twitter.com/LakelandPD/status/908323341521563649
mylkldelectric,2017-09-14 08:03,0,0,Every neighborhood around us had power for 2 day before us. It made it pretty hard to deal. But just woke up to it today. Hang tough.,,,,9.08300053684605E+017,https://twitter.com/Crampa6/status/908300053684604928
mylkldelectric,2017-09-14 07:59,0,0,We got ours back on this morning! What a great way to wake up. Thanks,,,,9.08299111941669E+017,https://twitter.com/Crampa6/status/908299111941668866
mylkldelectric,2017-09-14 07:23,0,0,I told Nathan electric this and they said they didn't care it wasn't their problem they get back to my house whenever they Could,,,,9.08290031508447E+017,https://twitter.com/Joerua4/status/908290031508447232
mylkldelectric,2017-09-14 07:22,0,0,I'm having to pay $230 a day for a hotel room for my 89 year old mother because she has no electricity for her medical equipment,,,,9.08289802759537E+017,https://twitter.com/Joerua4/status/908289802759536641
mylkldelectric,2017-09-14 07:21,0,0,Lakeland Electric fix my neighbors but didn't fix mine because I had a line down in my front yard they said they didn't have time,,,,9.08289633938747E+017,https://twitter.com/Joerua4/status/908289633938747393
mylkldelectric,2017-09-14 06:55,0,0,2230 tanglwood st lakeland fl,,,,9.08282931059327E+017,https://twitter.com/Ivanesp23487571/status/908282931059326976
mylkldelectric,2017-09-14 06:46,0,0,"Now, I'm sure they can find the humor in that but each update, watch the number drop... #hope #perspective #lakelandstrong",,,#hope #perspective #lakelandstrong,9.08280711517544E+017,https://twitter.com/b24cc4b304fd432/status/908280711517544449
mylkldelectric,2017-09-14 06:43,0,0,"I'll give it for busting their asses to try to keep us informed and calm,it recognized here.. #dontshootthemessanger",,,#dontshootthemessanger,9.08280089229525E+017,https://twitter.com/b24cc4b304fd432/status/908280089229524993
mylkldelectric,2017-09-14 06:42,0,1,"Tonight sucked but I notice every night less stars.. that's a good sign.. they are working hard, I talked to a few. #lakelandstring",,,#lakelandstring,9.08279728804639E+017,https://twitter.com/b24cc4b304fd432/status/908279728804638720
mylkldelectric,2017-09-14 06:39,0,0,"I saw the damage the day after and see them Working hard everyday, it sucks, I agree but we got this #lakelandstrong",,,#lakelandstrong,9.08279072907825E+017,https://twitter.com/b24cc4b304fd432/status/908279072907825153
mylkldelectric,2017-09-14 06:37,0,0,"I live in the. Hieghts and I feel you,but we see them everyday, I know I see it.. thank you for hard work, stay safe. #lakelandstrong",,,#lakelandstrong,9.08278647253094E+017,https://twitter.com/b24cc4b304fd432/status/908278647253094400
mylkldelectric,2017-09-14 06:05,0,0,Looks like just a tree branch is preventing several houses at Dovehollow Rd to get electricity. #LKLD,,,#LKLD,9.08270360688251E+017,https://twitter.com/marcos707/status/908270360688250880
mylkldelectric,2017-09-14 05:55,1,1,The fact that it takes time to restore power we get. What we don't get is the absolute void of valuable information. Your pr is offensive,,,,9.08268045596025E+017,https://twitter.com/Izi____/status/908268045596024832
mylkldelectric,2017-09-14 04:30,0,1,Tree was removed on Tuesday! Thank you so much for all that you guys are doing!,,,,9.08246609435267E+017,https://twitter.com/BostonFoodLove/status/908246609435267073
mylkldelectric,2017-09-14 00:43,0,2,You rock! Thank you for the help.,,,,9.08189516602716E+017,https://twitter.com/WolfKJM/status/908189516602716160
mylkldelectric,2017-09-14 00:41,0,0,We need power restored at 4238 chestnut please,,,,9.08188991727514E+017,https://twitter.com/StandiferSheila/status/908188991727513600
mylkldelectric,2017-09-14 00:25,0,1,Tonight is by far the warmest night but it's ok... this too will pass. @mylkldelectric will remedy the situation soon.,,@mylkldelectric,,9.08185023441973E+017,https://twitter.com/fscmike/status/908185023441973252
mylkldelectric,2017-09-14 00:18,0,0,I live off Dossey road - thankfully they saw my tweet yesterday & did have the tree blocking us in cut away. But PLEASE restore our power!!,,,,9.08183158423736E+017,https://twitter.com/stacielee1313/status/908183158423736322
mylkldelectric,2017-09-14 00:14,0,0,Don't know what kind of fucking schedule that is...,,,,9.0818223943068E+017,https://twitter.com/dylan_mcclure/status/908182239430680578
mylkldelectric,2017-09-13 23:22,0,0,Right here with ya...,,,,9.08169134621503E+017,https://twitter.com/BryanByak/status/908169134621503488
mylkldelectric,2017-09-13 23:21,0,0,PLEASE come to Cleveland Heights - Sylvester Rd.,,,,9.08168921794183E+017,https://twitter.com/BryanByak/status/908168921794183168
mylkldelectric,2017-09-13 23:13,0,0,Be thankful you were given a precise timeline. We were given 4 days to 4 weeks,,,,9.08166891298021E+017,https://twitter.com/cupcakelyfe15/status/908166891298021377
mylkldelectric,2017-09-13 23:11,0,0,And up more since then,,,,9.0816634618105E+017,https://twitter.com/cupcakelyfe15/status/908166346181050368
mylkldelectric,2017-09-13 23:10,0,0,Dropping?,,,,9.08165942793957E+017,https://twitter.com/cupcakelyfe15/status/908165942793957377
mylkldelectric,2017-09-13 23:05,0,0,Which part of town?,,,,9.08164882658464E+017,https://twitter.com/cupcakelyfe15/status/908164882658463745
mylkldelectric,2017-09-13 23:01,0,0,"Going on 72 hours, in a mobile home, with furbabies, reaching 95 inside!! Hurry or we will heat stroke",,,,9.08163884594422E+017,https://twitter.com/cupcakelyfe15/status/908163884594421761
mylkldelectric,2017-09-13 23:01,0,0,@lakelandgov @mylkldelectric another night another struggle. No power. Sleep apnea. Can't fall asleep with no power to my machine. Thanks :(,,@lakelandgov @mylkldelectric,,9.08163817531732E+017,https://twitter.com/zechs34/status/908163817531731968
mylkldelectric,2017-09-13 22:59,0,0,They did the same to us. Told us 4 days to 4 weeks!!!,,,,9.08163317637816E+017,https://twitter.com/cupcakelyfe15/status/908163317637816320
mylkldelectric,2017-09-13 22:26,0,0,"In 2004 Charlie pass near by and I was two days with out power. Not the same, (I know) but Lakeland Electric was smaller and less Technology",,,,9.08155013859611E+017,https://twitter.com/Torresal1960/status/908155013859610625
mylkldelectric,2017-09-13 22:22,0,1,Is no crew around the Dossey Road or Pippkin Road. Feels like we going to in the dark another night.,,,,9.08153938691621E+017,https://twitter.com/Torresal1960/status/908153938691620864
mylkldelectric,2017-09-13 22:14,0,0,Power,,,,9.08152003372749E+017,https://twitter.com/Torresal1960/status/908152003372748800
mylkldelectric,2017-09-13 22:14,0,0,The irony of all this is that the next door subdivision Colonnades has power and the street across the entrance of Wildwood Subdivision has,,,,9.0815195937871E+017,https://twitter.com/Torresal1960/status/908151959378710528
mylkldelectric,2017-09-13 22:14,0,1,So glad to report that my folks now have electricity...Thanks to @mylkldelectric,,@mylkldelectric,,9.08151846040154E+017,https://twitter.com/MsEbonye2u/status/908151846040154112
mylkldelectric,2017-09-13 22:09,0,1,"I just drove by Dossey Road, and tree is cut but ground line still down. Is probably between 500 to 800 feet down, about 2 to 3 hours work.",,,,9.08150791256625E+017,https://twitter.com/Torresal1960/status/908150791256625152
mylkldelectric,2017-09-13 22:09,0,0,S Hilltop is still out.,,,,9.08150685845385E+017,https://twitter.com/ColletteAlyson/status/908150685845385217
mylkldelectric,2017-09-13 22:08,0,1,Thk u @mylkldelectric,,@mylkldelectric,,9.0815041900791E+017,https://twitter.com/r2foundation/status/908150419007909888
mylkldelectric,2017-09-13 21:50,0,3,God bless you all!,,,,9.08145902749143E+017,https://twitter.com/ladygwb62/status/908145902749143041
mylkldelectric,2017-09-13 21:44,0,0,I want to thank lakeland electric for getting our elec back on at May Manor Mobile Home Park. I was a bit test last nite. I'm sorry,,,,9.08144495052685E+017,https://twitter.com/flmike07734/status/908144495052685317
mylkldelectric,2017-09-13 21:33,0,0,I can see power plant form my house but no power at my house,,,,9.08141563523555E+017,https://twitter.com/yoularty/status/908141563523555328
mylkldelectric,2017-09-13 21:30,0,0,Combee no t fix tree on the road,,,,9.08140784901292E+017,https://twitter.com/yoularty/status/908140784901292032
mylkldelectric,2017-09-13 21:27,0,3,And how do we know what's the more complex work? Why leave people guessing while the temps increase outside and people have no place to go,,,,9.08140121106666E+017,https://twitter.com/politlady/status/908140121106665472
mylkldelectric,2017-09-13 21:22,0,2,"E. Park Street & Success need A/C! Babies, Senior Citizens, and puppies are getting overheated",,,,9.08138971359797E+017,https://twitter.com/chaseyf/status/908138971359797248
mylkldelectric,2017-09-13 21:13,0,0,"Still NO POWER since Sunday 6p. Polk City vicinity elderly, children need AC. Your time to shine & TECO losing as @mylkldelectric shines https:// twitter.com/TampaElectric/ status/908096610143481856 …",,@mylkldelectric,,9.08136566530421E+017,https://twitter.com/cruise4life2006/status/908136566530420736
mylkldelectric,2017-09-13 21:04,0,3,please come to cleveland heights…it's been 4 days and we haven't seen any trucks at all,,,,9.08134246988075E+017,https://twitter.com/FRIZZYCITRUS/status/908134246988075008
mylkldelectric,2017-09-13 21:03,0,1,I live off Cleveland heights and mine got restored this afternoon,,,,9.08134068721799E+017,https://twitter.com/tamsprote96/status/908134068721799169
mylkldelectric,2017-09-13 20:53,0,2,I would love to know where the crews are that we were told would be out 24/7 to fix our power. Please tweet me proof.,,,,9.08131649925243E+017,https://twitter.com/Cyan1137/status/908131649925242880
mylkldelectric,2017-09-13 20:51,0,0,@mylkldelectric so like when can pipkin expect power to be back on?,,@mylkldelectric,,9.08131135892357E+017,https://twitter.com/ColeJohn_/status/908131135892357120
mylkldelectric,2017-09-13 20:35,0,3,What schedule? Tell the people so we can plan. Should I drive 3 hours to my mothers? Might the electric be restored 1 hour after I leave?,,,,9.08127030503502E+017,https://twitter.com/Skykingrgc/status/908127030503501825
mylkldelectric,2017-09-13 20:32,0,0,Getting some AC in the car. 4th day without power at Audubon Oaks in #Lakeland . Please fix our power @lakelandgov and @mylkldelectric #Irma pic.twitter.com/A4a8v6l1rj,,@lakelandgov @mylkldelectric,#Lakeland #Irma,9.08126195371389E+017,https://twitter.com/KirilLange/status/908126195371388928
mylkldelectric,2017-09-13 20:30,0,0,"@mylkldelectric Grid S9 Pipking Road specially Wildwood Subdivision still in the dark however, Dossey Road down tree is out of the way",,@mylkldelectric,,9.08125674803794E+017,https://twitter.com/Torresal1960/status/908125674803793920
mylkldelectric,2017-09-13 20:27,0,2,you ARE telling us to look at the outage map..... Just saying. Almost at 11000??,,,,9.08125063358054E+017,https://twitter.com/justah_voice/status/908125063358054405
mylkldelectric,2017-09-13 20:27,0,6,Tnk God we did not get Cat 4+, it wld be a chaotic war zone. ASCE rates our systems poorly. 2017 = time for redundancy/subsurface lines.,,,9.08125063358054E+017,https://twitter.com/justah_voice/status/1
mylkldelectric,2017-09-13 20:23,0,1,Tnk God we did not get Cat 4+, it wld be a chaotic war zone. ASCE rates our systems poorly. 2017 = time for redundancy/subsurface lines.,,,9.08125063358054E+017,https://twitter.com/justah_voice/status/2
