mylkldelectric,2017-09-27 06:08,0,0,@mylkldelectric power. Just went out in North Lakeland by Socrum Loop.,,@mylkldelectric,,9.12982333736792E+017,https://twitter.com/mcx1979/status/912982333736792064
mylkldelectric,2017-09-26 16:16,0,0,Hurricane Irma Update: Our office is now open. A huge THANK YOU to @mylkldelectric !,,@mylkldelectric,,9.12772978974368E+017,https://twitter.com/Eventrics/status/912772978974367745
mylkldelectric,2017-09-24 01:36,0,0,@mylkldelectric We keep hearing booms like transformers blowing.,,@mylkldelectric,,9.11826588051935E+017,https://twitter.com/HollandCp/status/911826588051935232
mylkldelectric,2017-09-24 00:46,0,0,@mylkldelectric Thank you !!! Went to the drive in tonight and came home to power !!! Thank you !!,,@mylkldelectric,,9.11814080230511E+017,https://twitter.com/iliff713/status/911814080230510592
mylkldelectric,2017-09-23 18:29,0,0,Power's out again! Transformer by #patio850 blew. @mylkldelectric,,@mylkldelectric,#patio850,9.11719092972909E+017,https://twitter.com/ivyadrena/status/911719092972908545
mylkldelectric,2017-09-23 16:32,0,0,@mylkldelectric if all the repairs have been finished from Irma. . How come no one has been to my house to repair the line ?,,@mylkldelectric,,9.11689641094521E+017,https://twitter.com/iliff713/status/911689641094520833
mylkldelectric,2017-09-23 08:25,0,0,"Lakeland electric is awesome, thank you @mylkldelectric",,@mylkldelectric,,9.11567249508635E+017,https://twitter.com/ryegge/status/911567249508634630
mylkldelectric,2017-09-23 08:03,4,23,Now that’s more like it… ( @mylkldelectric reports 0 outages right now.) #lkld pic.twitter.com/M3O5XVCblt,,@mylkldelectric,#lkld,9.1156175641743E+017,https://twitter.com/lkldnow/status/911561756417429504
mylkldelectric,2017-09-21 22:59,0,2,Heartfelt THANK YOU to @mylkldelectric for the tireless hours spent making us comfortable in our homes again. https:// twitter.com/lakelandcra/st atus/910881660459212801 …,,@mylkldelectric,,9.11062413625217E+017,https://twitter.com/nicolebtravis/status/911062413625217024
mylkldelectric,2017-09-21 21:39,0,0,@TECOEnergy @TampaElectric - this is nice. I'd made plans if I knew power would be out tonight (polk city) Thank You for everything though:),,@TECOEnergy @TampaElectric,,9.11042215119552E+017,https://twitter.com/AeSix/status/911042215119552512
mylkldelectric,2017-09-21 21:19,0,0,,,,,9.11037187260592E+017,https://twitter.com/stacielee1313/status/911037187260592128
mylkldelectric,2017-09-21 16:46,0,0,@mylkldelectric Just called and something about underground damage on 92. I'm around new Tampa Hwy. Any idea how long it will take?,,@mylkldelectric,,9.10968457260405E+017,https://twitter.com/ShinyMouse/status/910968457260404736
mylkldelectric,2017-09-21 15:46,0,0,@mylkldelectric lost power at the Kathleen Post Office 33849...any idea how long it will be out?,,@mylkldelectric,,9.10953525227729E+017,https://twitter.com/gary_desmond1/status/910953525227728896
mylkldelectric,2017-09-21 15:39,1,3,. @mylkldelectric says due to #Irma they're postponing all disconnects due to nonpayment until October 23rd. @FOX13News,,@mylkldelectric @FOX13News,#Irma,9.10951664852578E+017,https://twitter.com/LucasBoggPhotog/status/910951664852578304
mylkldelectric,2017-09-21 12:30,0,0,"Spectrum made policy changes in April that were tactical mistakes & and against consumers. I tried, but give up.",,,,9.10904184832238E+017,https://twitter.com/SwampysFlorida/status/910904184832237568
mylkldelectric,2017-09-21 12:28,0,0,I'm having to leave Spectrum. Been with same company since were Cablevision. Impossible to work with.,,,,9.10903691963781E+017,https://twitter.com/SwampysFlorida/status/910903691963781120
mylkldelectric,2017-09-21 11:06,0,0,Call FEMA I sent like,,,,9.10883005446713E+017,https://twitter.com/RighteousPromo/status/910883005446713344
mylkldelectric,2017-09-21 00:34,0,1,"Promise and let down, lack of communication, or just flat out lying causes patience to run thin",,,,9.10723832272572E+017,https://twitter.com/ShinyMouse/status/910723832272572416
mylkldelectric,2017-09-21 00:33,0,1,"Still no power. Still more posts about we plan on X, but it doesn't happen. Listen majority of us are trying to be polite, but the constant",,,,9.1072372481031E+017,https://twitter.com/ShinyMouse/status/910723724810309632
mylkldelectric,2017-09-21 00:32,0,1,Ok so there's no damage to my meter or weatherhead. It's the transformer. I'm tired of putting in a ticket. A day has passed already,,,,9.10723384039936E+017,https://twitter.com/ShinyMouse/status/910723384039936000
mylkldelectric,2017-09-20 22:06,0,3,,,,,9.10686738183606E+017,https://twitter.com/Crampa6/status/910686738183606272
mylkldelectric,2017-09-20 18:01,1,0,Godspeed and Thank you to those who are headed home after helping the Lakeland #lkld Florida #polk communities #IrmaRecovery @mylkldelectric https:// twitter.com/LakelandPD/sta tus/910562706666778624 …,,@mylkldelectric,#lkld #polk #IrmaRecovery,9.10624885176701E+017,https://twitter.com/FriarWade/status/910624885176700928
mylkldelectric,2017-09-20 16:39,3,10,THANK YOU. THANK YOU. THANK YOU. We can't say it enough! We appreciate each and everyone one who helped us here in Lakeland!,,,,9.10604249645683E+017,https://twitter.com/LakelandPD/status/910604249645682689
mylkldelectric,2017-09-20 16:25,2,9,Thanks @KinstonPublServ & @GUC_Info for the hard work! Thank you @LakelandPD & @mylkldelectric for treating our #NCPublicPower guys well! https:// twitter.com/KinstonPublSer v/status/910503947932196864 …,,@KinstonPublServ @GUC_Info @LakelandPD @mylkldelectric,#NCPublicPower,9.10600815609512E+017,https://twitter.com/ElectriCitiesNC/status/910600815609511937
mylkldelectric,2017-09-20 16:02,0,2,Thank you Lakeland Electric and a special thanks to out of town linemen,,,,9.10594999296897E+017,https://twitter.com/fiahkris/status/910594999296897024
mylkldelectric,2017-09-20 15:03,0,0,"my power was on after 5 days just for you village people dressing Sissy's to cut my shit off to ""work"" on the line",,,,9.10580226748543E+017,https://twitter.com/justah_voice/status/910580226748542976
mylkldelectric,2017-09-20 14:53,0,0,#SUPPORT_SOLARPANNEL,,,#SUPPORT_SOLARPANNEL,9.10577744311984E+017,https://twitter.com/justah_voice/status/910577744311984128
mylkldelectric,2017-09-20 14:53,0,0,IF I DIDN'T NOTIFY THEY FU*K ASS ABOUT A PAYMENT I BET YOU THEY WOULD SO SOMETHING.,,,,9.10577549356479E+017,https://twitter.com/justah_voice/status/910577549356478464
mylkldelectric,2017-09-20 14:51,0,0,JUST REPLACED MY SHIT 4 NOTHING.,,,,9.105772505711E+017,https://twitter.com/justah_voice/status/910577250571100160
mylkldelectric,2017-09-20 14:51,0,0,NO NOTIFICATION. WHEN I CALLED THEY SAID THEY DONT HAVE TO NOTIFY US. I DONT GET FOOD STAMPS,,,,9.10577165867082E+017,https://twitter.com/justah_voice/status/910577165867081728
mylkldelectric,2017-09-20 13:44,0,2,So grateful for their support of our community. Safe travels.,,,,9.10560359475446E+017,https://twitter.com/Chewtoy_/status/910560359475445762
mylkldelectric,2017-09-20 13:27,0,0,"Ya, but now tons are without internet. Thanks for nothing @GetSpectrum",,@GetSpectrum,,9.10555923311194E+017,https://twitter.com/ChrisATLprayer/status/910555923311194120
mylkldelectric,2017-09-20 12:12,11,28,"Now that almost all @mylkldelectric customers have power restored, out of town crews left #Lkld today with quite the send off. @FOX13News pic.twitter.com/EuCLVzR2fH",,@mylkldelectric @FOX13News,#Lkld,9.10537149967208E+017,https://twitter.com/LucasBoggPhotog/status/910537149967208449
mylkldelectric,2017-09-20 11:39,0,0,God speed and safe travels. We deeply appreciate your help!!,,,,9.10528843009667E+017,https://twitter.com/MizPecas/status/910528843009667074
mylkldelectric,2017-09-20 10:49,0,1,The remaining customers have had their lives on hold far to long. Don't send all the outside support home too soon.,,,,9.10516197468328E+017,https://twitter.com/Skykingrgc/status/910516197468327936
mylkldelectric,2017-09-20 10:49,0,0,With our deep gratitude. Thanks!,,,,9.10516156133528E+017,https://twitter.com/stedun/status/910516156133527552
mylkldelectric,2017-09-20 10:00,5,9,Live video of the linemen from KPS and @GUC_Info headed home with @LakelandPD escort! Thanks @mylkldelectric ! https://www. facebook.com/kinstonpublics ervices/posts/1425655167484212 …,,@GUC_Info @LakelandPD @mylkldelectric,,9.10503947932197E+017,https://twitter.com/KinstonPublServ/status/910503947932196864
mylkldelectric,2017-09-20 09:45,0,1,Thank u #linemen,,,#linemen,9.10500153160856E+017,https://twitter.com/Aliciafussell1/status/910500153160855552
mylkldelectric,2017-09-20 09:13,0,1,. @Publix I don't appreciate your employees telling me how I should feel after a hurricane.,,@Publix,,9.10492086805377E+017,https://twitter.com/Cyan1137/status/910492086805377024
mylkldelectric,2017-09-20 08:50,0,2,Great video from @mylkldelectric with Colby from @HSVUtilities who explains #PublicPower perfectly. #ThankALineman https:// twitter.com/HSVUtilities/s tatus/910222253970862081 …,,@mylkldelectric @HSVUtilities,#PublicPower #ThankALineman,9.10486237546451E+017,https://twitter.com/FMPAnews/status/910486237546450944
mylkldelectric,2017-09-20 06:12,0,2,Way to go @lakelandgov and @mylkldelectric always working hard. Great! Lineman are heros too! My dad was one for 40 years!,,@lakelandgov @mylkldelectric,,9.10446635867607E+017,https://twitter.com/FamilySecBrief/status/910446635867607040
mylkldelectric,2017-09-19 19:41,0,0,"@mylkldelectric we know your busy, a line is down but hey it's rolled up waiting to be reinstalled pic.twitter.com/LxdUbOFEgn",,@mylkldelectric,,9.10287754705154E+017,https://twitter.com/kevinakarogue/status/910287754705154048
mylkldelectric,2017-09-19 17:05,4,9,New @mylkldelectric outage update at http:// lakelandgov.net/hurricane . #LKLD pic.twitter.com/PTl8WlSpN8,,@mylkldelectric,#LKLD,9.10248431762989E+017,https://twitter.com/lakelandgov/status/910248431762989056
mylkldelectric,2017-09-19 16:57,0,0,@mylkldelectric Thank you for all your hard work and dedication.,,@mylkldelectric,,9.10246420568957E+017,https://twitter.com/PDilmari/status/910246420568956929
mylkldelectric,2017-09-19 16:54,0,0,@mylkldelectric Please have mercy on me. I have been 9 days without power. Me and my kids are dying here. #PLEASE HELP,,@mylkldelectric,#PLEASE,9.10245792480465E+017,https://twitter.com/PDilmari/status/910245792480464896
mylkldelectric,2017-09-19 16:34,2,1,Some @mylkldelectric customers may have damage to their weatherhead or metercan. These are owner's responsibility. #lkld pic.twitter.com/AIy37zBmeK,,@mylkldelectric,#lkld,9.10240829100511E+017,https://twitter.com/lakelandgov/status/910240829100511232
mylkldelectric,2017-09-19 16:31,0,1,Doing great work @mylkldelectric and @grda_ok ! #ThankALineman #PublicPower https:// twitter.com/lakelandgov/st atus/910235620722794499 …,,@mylkldelectric @grda_ok,#ThankALineman #PublicPower,9.10239890897621E+017,https://twitter.com/flpublicpower/status/910239890897620992
mylkldelectric,2017-09-19 16:20,1,3,"@mylkldelectric progress since noon: Outages: 1,800, down from 2,400 Crews: 420 workers, up from 400. #lkld #irmalkld https:// twitter.com/lakelandgov/st atus/910235620722794499 …",,@mylkldelectric,#lkld #irmalkld,9.1023720479402E+017,https://twitter.com/lkldnow/status/910237204794019840
mylkldelectric,2017-09-19 16:14,3,5,@mylkldelectric reports 1800 w/o power at 4:15pm. Over 420 crew on the ground to help restore power. @grda_ok getting it done. #lkld pic.twitter.com/UiETFRngIB,,@mylkldelectric @grda_ok,#lkld,9.10235620722795E+017,https://twitter.com/lakelandgov/status/910235620722794499
mylkldelectric,2017-09-19 15:48,0,0,Commissioner Troller we need real help here not an automated line or scripted cs with no real information. Do commissioners have a plan?,,,,9.10229179265962E+017,https://twitter.com/Izi____/status/910229179265961984
mylkldelectric,2017-09-19 15:24,0,0,We've lost faith in you and are quickly losing faith in city manager and commissioners.,,,,9.1022306543446E+017,https://twitter.com/Izi____/status/910223065434460160
mylkldelectric,2017-09-19 15:22,0,0,No where close to the three worst areas. No power Sunday. No power Monday. No power today. Ridiculous. LE management needs overhaul,,,,9.10222506124042E+017,https://twitter.com/Izi____/status/910222506124042243
mylkldelectric,2017-09-19 15:21,3,7,Many thanks to @mylkldelectric for this video featuring Colby from our FL crew: https:// goo.gl/s1j4SD #IrmaRecovery #PublicPower,,@mylkldelectric,#IrmaRecovery #PublicPower,9.10222253970862E+017,https://twitter.com/HSVUtilities/status/910222253970862081
mylkldelectric,2017-09-19 14:48,0,0,Details of the @mylkldelectric noon update are at https:// lakelandelectric.com / #lkld #irmalkld,,@mylkldelectric,#lkld #irmalkld,9.10213906735469E+017,https://twitter.com/lkldnow/status/910213906735468545
mylkldelectric,2017-09-19 14:47,1,0,"@mylkldelectric noon update: -2,400 customers have no power. -400 workers in the field. -Goal: Connect all without home damage by Wed.",,@mylkldelectric,,9.10213743195427E+017,https://twitter.com/lkldnow/status/910213743195426816
mylkldelectric,2017-09-19 11:56,0,1,I have as well. My power came back on ~36 hours ago yet I refuse to be silent until the very last customer is back online.,,,,9.10170738631602E+017,https://twitter.com/Skykingrgc/status/910170738631602176
mylkldelectric,2017-09-19 11:53,0,1,Another one of Lakeland Electric's worst enemies. An educated customer willing to share information and expose the truth.,,,,9.10170109116863E+017,https://twitter.com/Skykingrgc/status/910170109116862464
mylkldelectric,2017-09-19 11:53,0,1,"not knowing as well as being given ""estimates"" and time frames that aren't true",,,,9.101700610082E+017,https://twitter.com/lorddealwithit/status/910170061008199680
mylkldelectric,2017-09-19 11:51,0,2,Sad isn't it. Even is you get a rep Management tells them noting of the schedule. Not knowing makes it worse.,,,,9.10169421741687E+017,https://twitter.com/Skykingrgc/status/910169421741686785
mylkldelectric,2017-09-19 11:48,0,2,Obviously an educated customer and willing to do research. Probably not the kind of guy you want to make angry. He may start posting facts.,,,,9.10168709725131E+017,https://twitter.com/Skykingrgc/status/910168709725130757
mylkldelectric,2017-09-19 11:43,0,0,This has gone on much too long Lakeland Electric. These folks a hurting and your response disgusts me. Give them answers.,,,,9.10167557415502E+017,https://twitter.com/Skykingrgc/status/910167557415501824
mylkldelectric,2017-09-19 11:41,0,0,"A manager should be at your door to apologize, listen to your hardships and give you answers yet they hide and and say nothing",,,,9.10167093357814E+017,https://twitter.com/Skykingrgc/status/910167093357813761
mylkldelectric,2017-09-19 11:20,0,0,Update: can't even file a complaint on this guys with the regulators. What does that tell you? LE exists to serve a single large company,,,,9.10161594591715E+017,https://twitter.com/Izi____/status/910161594591715328
mylkldelectric,2017-09-19 11:15,0,2,Ditto! I'll remember this at the voting booth. File your grievance here http://www. floridapsc.com/ConsumerAssist ance/ComplaintForm … . Maybe it won't fall on deaf ears,,,,9.10160345540506E+017,https://twitter.com/Izi____/status/910160345540505600
mylkldelectric,2017-09-19 11:14,0,1,"Speak loudly my friend, you deserve better and your voice needs to be heard.",,,,9.101602195898E+017,https://twitter.com/Skykingrgc/status/910160219589799937
mylkldelectric,2017-09-19 11:09,0,0,Still no power yet not in a 'rebuilding zone' Unethical LE management deletes work orders to artificially inflate results. Commissioners?,,,,9.10158896232313E+017,https://twitter.com/Izi____/status/910158896232312832
mylkldelectric,2017-09-19 10:31,0,1,Have lost all faith in our communites management..,,,,9.10149332455821E+017,https://twitter.com/aaronatkinson20/status/910149332455821312
mylkldelectric,2017-09-19 10:30,0,1,3.3percent higher costs than most all utilities in Florida With a 100 percent low customer satisfaction,,,,9.10149125873787E+017,https://twitter.com/aaronatkinson20/status/910149125873786881
mylkldelectric,2017-09-19 10:24,0,0,Lakeland Electric hung up on me as soon as i got on the phone and asked if there was an update day 10. this company @mylkldelectric,,@mylkldelectric,,9.10147587373769E+017,https://twitter.com/lorddealwithit/status/910147587373768705
mylkldelectric,2017-09-19 10:22,0,0,Bahahahaha.. Keep telling yourself that..makes you feel better.. Crews eating steak at longhorns at nine then never returned back,,,,9.10147144316747E+017,https://twitter.com/aaronatkinson20/status/910147144316747777
mylkldelectric,2017-09-19 10:20,0,0,Easy to throw numbers around Hmmm because all you are is a number..HIGH PRICES LOW CUSTOMER SATISFACTION..,,,,9.10146554526302E+017,https://twitter.com/aaronatkinson20/status/910146554526302208
mylkldelectric,2017-09-19 10:18,0,0,I see more line crews sitting in st Pete at staging area at ten thirty than I've seen all week in lakeland..fact,,,,9.10145973317522E+017,https://twitter.com/aaronatkinson20/status/910145973317521415
mylkldelectric,2017-09-19 10:16,0,0,Keep patting yourself Works for you...pathetic,,,,9.10145504507499E+017,https://twitter.com/aaronatkinson20/status/910145504507498496
mylkldelectric,2017-09-19 10:09,0,1,Fake news,,,,9.10143690932474E+017,https://twitter.com/aaronatkinson20/status/910143690932473861
mylkldelectric,2017-09-19 10:08,0,0,More lies.. Fake news,,,,9.10143537605378E+017,https://twitter.com/aaronatkinson20/status/910143537605378049
mylkldelectric,2017-09-19 10:08,0,0,Lakeland electrics management Is got to be the worst I've seen anywhere when dealing with utilities,,,,9.10143438938657E+017,https://twitter.com/aaronatkinson20/status/910143438938656768
mylkldelectric,2017-09-19 10:06,0,1,I have seen more trucks in 30 min in st Pete than I have seen in lakeland in a week..pathetic,,,,9.10143102077358E+017,https://twitter.com/aaronatkinson20/status/910143102077358080
mylkldelectric,2017-09-19 10:03,1,0,Over fifty crews sitting idle near st Pete..why don't you call them..seen more crews here in 30 min than I've seen in lakeland ever,,,,9.10142268203586E+017,https://twitter.com/aaronatkinson20/status/910142268203585536
mylkldelectric,2017-09-19 07:13,0,0,Not true at all I live on three phase Tap pulls directly off of it Tired of watching crews drive by..especially when it is an easy fix..,,,,9.10099565528982E+017,https://twitter.com/aaronatkinson20/status/910099565528981504
mylkldelectric,2017-09-19 06:59,0,0,Crews left us hanging again One tap over and they just left Said you were working 16 hrs Then explain. Them leaving at eight not returning,,,,9.10095908741812E+017,https://twitter.com/aaronatkinson20/status/910095908741812224
mylkldelectric,2017-09-19 06:55,0,2,Going to share my story with the news ..and all of my video..going to show the incompetence of your management,,,,9.10095033986101E+017,https://twitter.com/aaronatkinson20/status/910095033986101248
mylkldelectric,2017-09-19 06:54,0,1,And tell that lil boy who keeps just riding around looking at the same shit he did for two days that yes it still the same..,,,,9.10094804729647E+017,https://twitter.com/aaronatkinson20/status/910094804729647105
mylkldelectric,2017-09-19 06:53,0,1,Going to video the crew when it finally shows up and it takes less than 15 min to fix..live off three phase.should of been hot the first day,,,,9.10094448574517E+017,https://twitter.com/aaronatkinson20/status/910094448574517248
mylkldelectric,2017-09-19 06:51,0,1,Will be sharing on you tube today the crews riding by..crews leaving at eight..not working around the clock like you said,,,,9.10093978778981E+017,https://twitter.com/aaronatkinson20/status/910093978778980352
mylkldelectric,2017-09-19 06:50,0,1,So 100 crews here to help.. More like suck off of FEMA Worst storm recovery ever Charge high prices Then keep shitting on customers,,,,9.10093648720777E+017,https://twitter.com/aaronatkinson20/status/910093648720777217
mylkldelectric,2017-09-19 06:48,0,1,You have got to get someone who knows how to run a utility when ppl are suffering..watched crews just drive by all day..FU,,,,9.10093271652864E+017,https://twitter.com/aaronatkinson20/status/910093271652864000
mylkldelectric,2017-09-19 06:46,0,1,All we need fixed is a fn fuse Nine days and can't get one crew to help..watched and videoed crews just ride by..got all of it videoed,,,,9.10092848091091E+017,https://twitter.com/aaronatkinson20/status/910092848091090944
mylkldelectric,2017-09-19 06:45,0,1,Yesterday your crews were one tap over from ours and left us hanging again..left at 8:15 pm and never returned..around the clock huh..FU,,,,9.10092417994494E+017,https://twitter.com/aaronatkinson20/status/910092417994493953
mylkldelectric,2017-09-18 23:02,0,0,Yes I believe management was slow to ask for adequate help leaving local linemen overwhelmed and I fully support all of the front line folks,,,,9.09975947973202E+017,https://twitter.com/Skykingrgc/status/909975947973201920
mylkldelectric,2017-09-18 22:45,0,1,"@mylkldelectric customers without power is down to 2,757, 2 percent of the total base, current outage map shows. #lkld #irmalkld pic.twitter.com/KlRNHkkaf6",,@mylkldelectric,#lkld #irmalkld,9.09971806693536E+017,https://twitter.com/lkldnow/status/909971806693535744
mylkldelectric,2017-09-18 20:15,0,1,Wrong!,,,,9.09933958686704E+017,https://twitter.com/oldarmyvet54/status/909933958686703616
mylkldelectric,2017-09-18 20:15,0,0,@mylkldelectric Griffin Ave WAS on a brown out your crews worked on a pole shorted something & now whole street is out! 78yr old mom in dark,,@mylkldelectric,,9.09933870652551E+017,https://twitter.com/oldarmyvet54/status/909933870652551168
mylkldelectric,2017-09-18 18:45,0,1,So glad to finally have our power back. Thank you @mylkldelectric !,,@mylkldelectric,,9.09911355167212E+017,https://twitter.com/CakeMasterYT/status/909911355167211525
mylkldelectric,2017-09-18 18:25,0,2,This isn't okay. These folks need help.,,,,9.09906171166954E+017,https://twitter.com/Skykingrgc/status/909906171166953472
mylkldelectric,2017-09-18 17:57,2,7,Photos sent to us today by grateful #Lakeland residents of our crews restoring power for @mylkldelectric . #Kissimmee #PublicPower #mutualaid pic.twitter.com/cSe7oaMAT9,,@mylkldelectric,#Lakeland #Kissimmee #PublicPower #mutualaid,9.09899252779897E+017,https://twitter.com/KUAdirect/status/909899252779896833
mylkldelectric,2017-09-18 17:48,0,0,"Hey @mylkldelectric My mother-in-law still doesnt have power. They live at Timberlake Rd South, and Harellson. Any updates?",,@mylkldelectric,,9.09897057485361E+017,https://twitter.com/brettexplains/status/909897057485361152
mylkldelectric,2017-09-18 17:48,8,13,"#LKLD POWER RESTORATION UPDATE: At 4:45pm, @myLKLDelectric reports that 3.3K customers are without power. Read more: http:// lakelandgov.net/hurricane pic.twitter.com/Yemne21XUR",,@myLKLDelectric,#LKLD,9.098968685488E+017,https://twitter.com/lakelandgov/status/909896868548800512
mylkldelectric,2017-09-18 17:29,0,0,Brook loop,,,,9.09892277107032E+017,https://twitter.com/sup3rFly83/status/909892277107032064
mylkldelectric,2017-09-18 17:06,0,0,More added today and yet no sign of them..one truck n my neighborhood and many just passing thru..smdh.. You suck,,,,9.09886437151126E+017,https://twitter.com/aaronatkinson20/status/909886437151125506
mylkldelectric,2017-09-18 16:53,0,1,Wow you got a rep..thought they were an endangered specie..,,,,9.0988320069621E+017,https://twitter.com/aaronatkinson20/status/909883200696209408
mylkldelectric,2017-09-18 16:51,0,0,Seven days no power One person to walk with a hot stick and put in one fuse..nope..just keep driving by,,,,9.09882502579413E+017,https://twitter.com/aaronatkinson20/status/909882502579412993
mylkldelectric,2017-09-18 16:08,0,0,@LafUtilities working hard for @mylkldelectric ! Thank you! #ThankALineman #PublicPower https:// twitter.com/LafUtilities/s tatus/909863481251266561 …,,@LafUtilities @mylkldelectric,#ThankALineman #PublicPower,9.09871691681104E+017,https://twitter.com/flpublicpower/status/909871691681103873
mylkldelectric,2017-09-18 15:35,3,5,Restoration efforts continue in Lakeland. #publicpower #lakelandstrong @mylkldelectric pic.twitter.com/ulZ9OM5yN7,,@mylkldelectric,#publicpower #lakelandstrong,9.09863481251266E+017,https://twitter.com/LafUtilities/status/909863481251266561
mylkldelectric,2017-09-18 15:21,0,0,and don't tell me it's cause we are on a different grid. i know that. i've known that since 8-9 days ago when i first reported outage,,,,9.09860054895153E+017,https://twitter.com/lorddealwithit/status/909860054895153152
mylkldelectric,2017-09-18 15:21,0,1,Fairway Ave. how is this okay? why should we suffer seeing lights at houses and hearing AC when we can't enjoy the same?,,,,9.09859952608637E+017,https://twitter.com/lorddealwithit/status/909859952608636933
mylkldelectric,2017-09-18 15:20,0,1,"a rep literally said to me on the phone Saturday that we would be up by the end of Sunday. not possibly, not probably, not hopefully",,,,9.09859766800994E+017,https://twitter.com/lorddealwithit/status/909859766800994304
mylkldelectric,2017-09-18 15:20,0,1,since you won't reply to me on facebook why is it that everyone on my street has had power since wed yet me and 7 others are still out???,,,,9.09859636316172E+017,https://twitter.com/lorddealwithit/status/909859636316172288
mylkldelectric,2017-09-18 15:16,0,0,Just about everyone is out watching them.,,,,9.09858653930443E+017,https://twitter.com/MaPoStormborn/status/909858653930442753
mylkldelectric,2017-09-18 15:12,0,2,3 pm update. @mylkldelectric still here and working. pic.twitter.com/Upk7QR2DHn,,@mylkldelectric,,9.09857803430498E+017,https://twitter.com/MaPoStormborn/status/909857803430498305
