Tweet,Category,Date,Permalink
"1/3 We understand your frustration. Partial power may be caused by tripped breakers, a blown fuse, or damaged connections.",7,09/20/2017,/insideFPL/status/910414598683193344
We apologize for the confusion. We take restoration very seriously. The delay may be from hidden damage.,7,09/16/2017,/insideFPL/status/909078529085788162
1/3 We are continuing to determine the full extent of damage while we restore power following Hurricane Irma.,7,09/20/2017,/insideFPL/status/910380357077405696
", while we fixed the main line, localized damage on the lines/transformer may be the issue. Pls report on    ",7,09/16/2017,/insideFPL/status/909081946269077504
"3/5 Unfortunately, these repairs did not result in service being restored and is likely due to more localized damage.",7,09/19/2017,/insideFPL/status/910321363415650304
Partnering with other first responders to restore and rebuild our communities. #Irma  #FloridaStrong,7,09/11/2017,/insideFPL/status/907382001589739520
1/3 We can understand your concern for your grandmother & the other residents. We’re still working on our restoration efforts.,7,09/17/2017,/insideFPL/status/909514538751610880
We may have found damage not visible to you as crews work on issues from multiple areas. We’re working 24/7 to restore power.,7,09/16/2017,/insideFPL/status/909210395923161089
This storm is 300 miles wide. We’re beginning to feel the effects of the outer bands.,7,09/09/2017,/insideFPL/status/906524360365703168
"@ savefilez  1/3 We're sorry to hear you're out of power. As we’re restoring service, we're continuing to determine the full extent of damage.",7,09/18/2017,/insideFPL/status/909702165769441280
1/3 A huge number of wires and damaged equipment have been reported & every one of them is a concern to us.,7,09/19/2017,/insideFPL/status/910274051880488962
1/3 We’re working safely & as quickly as possible on restoration. Call 911 if you’re experiencing a life-threatening emergency.,7,09/16/2017,/insideFPL/status/909085980640112640
Stay away from flooding caused by #Irma . Don’t go out in the dark because you might not see a downed power line.    ,7,09/10/2017,/insideFPL/status/906879945321930752
"Our thoughts are with Puerto Rico, the U.S. Virgin Islands and all those recovering from #HurricaneMaria . Stay strong and stay safe.",7,09/20/2017,/insideFPL/status/910580086277013507
1/2 We apologize for disappointing you. We take restoration very seriously. The delay may be from hidden damage.,7,09/17/2017,/insideFPL/status/909607787881222145
2/3 We understand your concern for the safety of your family. Your concerns are important to us.,7,09/21/2017,/insideFPL/status/910872628642107392
2/3 We’re working 24/7 to restore power by fixing damaged equipment and may have uncovered new damage that may not be visible.,7,09/18/2017,/insideFPL/status/909709464877588480
1/4 Our restoration plan is to safely find and fix the damage that brings power to the most people in the fewest hours.,7,09/05/2017,/insideFPL/status/905215926928379904
"We want to urge safety now more than ever. Ensure that all electric appliances, especially ovens and stoves, are turned off to prevent fires",7,09/13/2017,/insideFPL/status/908124004782878720
"Posible excepciones para áreas afectadas por tornados, inundaciones severas y otras áreas de daños severos.  us/907615533784322048   …",7,09/12/2017,/insideFPL/status/907617047521189888
"# UPDATE : East Coast - estimated power restoration by end of weekend, possible exception in areas hit by tornadoes, flooding & severe damage.",7,09/12/2017,/insideFPL/status/907614779568791554
"when servicing your main line, crews may encounter damage that isn’t visible to you as they’re working in multiple locations.",7,09/18/2017,/insideFPL/status/909860829541085185
"2/4 If there is a life-threatening situation, we urge residents to call 911. To find a special needs shelter call 311.",7,09/18/2017,/insideFPL/status/909812511016353793
"3/3 Now, we are working neighborhood by neighborhood- finding unexpected damage that impact our efforts to restore service.",7,09/20/2017,/insideFPL/status/910416369069502464
Please pay attention to warnings and orders to evacuate if you live in the following counties:     ,7,09/07/2017,/insideFPL/status/905885930711605249
We’re working 24/7 to restore power by fixing damaged equipment and may have uncovered new damage that may not be visible.,7,09/20/2017,/insideFPL/status/910553105732968448
2/3 This may occur when an issue is likely due to localized damage on the lines that deliver power directly to your home.,7,09/18/2017,/insideFPL/status/909873978566758400
"Please report any fallen wires, if they pose a clear and imminent danger to you or others by calling 911 or 1-800-4OUTAGE. Thanks.",7,09/19/2017,/insideFPL/status/910350030804017153
1/2 We understand your concern in regards to your safety.,7,09/16/2017,/insideFPL/status/909079917979209728
Concerned about storm surges from #Irma ? Learn how we monitor these flood waters to help keep your lights on.    ,7,09/08/2017,/insideFPL/status/906234557690773505
"when servicing your main line, crews may encounter damage that isn’t visible to you as they’re working in multiple locations.",7,09/16/2017,/insideFPL/status/909184225231941632
", please report any fallen wires if they pose a clear and imminent danger to you or others. Call 911 or 1-800-4OUTAGE.",7,09/16/2017,/insideFPL/status/909122474251636736
2/3 Please call 911 if you're is experiencing a life-threatening emergency.,7,09/16/2017,/insideFPL/status/909157447473954816
3/4 We urge residents to call 911 if you’re experiencing a life-threatening emergency.,7,09/16/2017,/insideFPL/status/909071535587110917
"2/3 Unfortunately, these repairs did not result in your service being restored and is likely due to more localized damage.",7,09/18/2017,/insideFPL/status/909713779994308608
"2/3 Now, we are working neighborhood by neighborhood- finding unexpected damage that impact our efforts to restore your service.",7,09/20/2017,/insideFPL/status/910379736840458242
We apologize for disappointing you. We take restoration very seriously. The delay may be hidden damage. Thx for your patience,7,09/18/2017,/insideFPL/status/909785332173934592
@ MikeTurek  Please report any fallen wires if they pose a clear and imminent danger to you or others. Call 911 or 1-800-4OUTAGE. Thank you.,7,09/16/2017,/insideFPL/status/909151630033063938
"3/3 Now, we are working neighborhood by neighborhood- finding unexpected damage that impact our efforts to restore service.",7,09/20/2017,/insideFPL/status/910419644913262593
1/3 We apologize for disappointing you. We take restoration very seriously. The delay may be from hidden damage.,7,09/20/2017,/insideFPL/status/910396232077598720
"24000+ personnel are committed to restoration. Flooding, fallen structures, debris & other obstacles have impacted the speed",2,09/18/2017,/insideFPL/status/909794897913368576
2/4 Please call 911 if you’re experiencing a life-threatening emergency.,7,09/16/2017,/insideFPL/status/909117659538710528
2/3 We apologize for any confusion. There may be localized damage on lines that deliver power directly to your neighborhood.,7,09/18/2017,/insideFPL/status/909854553213947904
Our reporting systems were impacted by Irma. Please report your outage if your power is still out@   ,7,09/16/2017,/insideFPL/status/909225392564826114
2/4 We urge residents to call 911 if there is a life-threatening situation. To find a special needs shelter near you call 311.,7,09/17/2017,/insideFPL/status/909425460358066176
2/3 There may be localized damage on lines that deliver power directly to your neighborhood.,7,09/18/2017,/insideFPL/status/909773254440755200
2/3 We urge residents to call 911 if you’re experiencing a life-threatening emergency.,7,09/16/2017,/insideFPL/status/909053509819133953
"2/4 As we’re restoring power, we are fixing damaged equipment, and uncovering new damage.",7,09/17/2017,/insideFPL/status/909561356323622912
"2/4 If there is a life-threatening situation, we urge residents to call 911. To find a special needs shelter call 311.",7,09/18/2017,/insideFPL/status/909816537825120256
", please report any fallen wires if they pose a clear and imminent danger to you or others. Call 911 or 1-800-4OUTAGE.",7,09/16/2017,/insideFPL/status/909122670620495872
1/3 We apologize for disappointing you. We take restoration very seriously. The delay may be from hidden damage.,7,09/16/2017,/insideFPL/status/909153690916933634
We continue to monitor #Irma  closely and have activated our emergency response plan.    ,7,09/07/2017,/insideFPL/status/905898483579748355
3/3 We value your safety and we will do our best to respond to this matter. Thank you for your patience.,7,09/18/2017,/insideFPL/status/909953286706548736
4/4 Tree trimming will resume once the storm has passed and power is restored. Thank you.,7,09/07/2017,/insideFPL/status/905831025254785024
"Please be careful. Stay far away from flooded areas and downed power lines. If you see a downed power line, call 911 or 1-800-4OUTAGE.",7,09/09/2017,/insideFPL/status/906683799370641408
"We know it is hard to lose food after an outage. However, we’re not responsible for spoiled food from an act of nature such as hurricanes.",7,09/15/2017,/insideFPL/status/908729705569882114
2/3 We take restoration very seriously. The delay may be from hidden damage.,7,09/18/2017,/insideFPL/status/909944882160128000
"2/3 Unfortunately, these repairs did not result in your service being restored and is likely due to more localized damage.",7,09/19/2017,/insideFPL/status/910024384651415553
Please report any fallen wires if they pose a clear and imminent danger to you or others. Call 911 or 1-800-4OUTAGE.,7,09/16/2017,/insideFPL/status/909124690664402944
"1/3 We understand being w/o power is frustrating. Storm damage can affect main power lines, individual power lines or both.",7,09/19/2017,/insideFPL/status/910058129471262720
Your safety is our priority. How to identify FPL workers: -Ask for FPL photo ID badge-Trucks are marked-Never need to enter your home,7,09/10/2017,/insideFPL/status/906896890922487809
Stay away from flooding caused by #Irma . Standing water may be hiding downed power lines that could be energized and dangerous. Stay safe.,7,09/11/2017,/insideFPL/status/907337591636287489
"1/2 We understand being w/o power is frustrating. Storm damage can affect main power lines, individual power lines or both.",7,09/17/2017,/insideFPL/status/909610293713567745
2/2 Please report any wire if they pose a clear and imminent danger to you or others. Call 911 or 1-800-4OUTAGE. Thank you.,7,09/16/2017,/insideFPL/status/909080185290584064
Reminder - stay away from downed lines. Crews are working safely and as quickly as possible in Ft. Myers to fix fallen power lines & damage.,7,09/21/2017,/insideFPL/status/910949261097017344
Working around the clock. We will not rest until your lights are back on.Customers impacted: 4.4 million Customers restored: 2.5 million,7,09/13/2017,/insideFPL/status/907961948041494528
Your safety is our priority. How to identify FPL workers:- Ask for FPL photo ID badge- Trucks are marked- Never need to enter your home  atus/907653724201476096   …,7,09/12/2017,/insideFPL/status/907682169316933634
"2/2 You can view our privacy policy at     . For your safety, please stay away from the hazardous area.",7,09/29/2017,/insideFPL/status/913860684160602114
"1/2 Partial power may be caused by tripped circuit breakers, a blown fuse, or damaged connections from the building to FPL.",7,09/16/2017,/insideFPL/status/909226258684432385
Please make sure it's reported by calling 1-800-4OUTAGE. We appreciate your patience and please stay safe.,7,09/16/2017,/insideFPL/status/909219710016909312
"With this powerful of a storm, customers should prepare for potentially prolonged power outages.    ",7,09/06/2017,/insideFPL/status/905490796954210304
"When servicing your main line, crews may encounter damage that isn’t visible to you as they’re working in multiple locations.",7,09/16/2017,/insideFPL/status/909214441950105601
Want to receive email updates from us before and after the storm? Sign up at    ,7,09/05/2017,/insideFPL/status/905219002338828288
"3/3 However, localized damage on equipment may be the issue. If you haven't done so, pls report on     .",7,09/18/2017,/insideFPL/status/909966921327661056
", report any hazardous conditions if they pose a clear & imminent danger to you or others. Call 911 or 1-800-4OUTAGE. Thanks.",7,09/16/2017,/insideFPL/status/909090754240315393
All hands on deck to get our state back to normal after #Irma . Thank you first responders for your help & determination. ,7,09/14/2017,/insideFPL/status/908434206312861696
"1/3 We understand your frustration. Partial power may be caused by tripped breakers, a blown fuse, or damaged connections.",7,09/19/2017,/insideFPL/status/910087267523457030
"2/4 If there is a life-threatening situation, we urge residents to call 911. To find a special needs shelter call 311.",7,09/19/2017,/insideFPL/status/910278194846208001
"Our crews are ready   . When it is safe, we will do everything possible throughout the storm to get your lights back on. #Irma",7,09/10/2017,/insideFPL/status/906849822417793024
1/2 thank you for reaching out. FPL is not responsible for retrieving storm related vegetation debris.,7,09/23/2017,/insideFPL/status/911790917442506752
"Given unprecedented volume, we’re experiencing intermittent issues on      and FPL Mobile App.",7,09/12/2017,/insideFPL/status/907795915972456448
"The storm is now upon us. Whenever it is safe to do so, we will work to get your lights back on. Please be careful out there. #Irma  l/status/906945650776068096   …",7,09/10/2017,/insideFPL/status/906949212377686017
"2/4 As we’re restoring power, we are continuing to determine the full extent of damage.",7,09/17/2017,/insideFPL/status/909591690293506049
"We will work to restore power throughout the storm, in between bands of severe weather, whenever it is safe to do so.  us/906524360365703168   …",1,09/09/2017,/insideFPL/status/906524486119378944
Don’t be alarmed if you get an automated call from us. We’re reaching out with storm prep info before #Irma  arrives.    ,7,09/07/2017,/insideFPL/status/905838107995631617
2/3 There may be localized damage on lines that deliver power directly to your neighborhood.,7,09/17/2017,/insideFPL/status/909563989306363905
2/3 This depends on the extent of damage and work required to restore your service.,7,09/17/2017,/insideFPL/status/909574035289382913
We’re watching #Irma  and getting prepared; please review your emergency plans.    ,7,09/05/2017,/insideFPL/status/905083222962339840
"2/4 After the storm, outages can be caused by loose trees and branches that impact power lines and electrical equipment.",1,09/21/2017,/insideFPL/status/911074073131839488
"1/2 In some areas, damage could require extended repair work and in extreme cases, require us to rebuild parts of our system.",7,09/17/2017,/insideFPL/status/909454653800280064
2/3 We take restoration very seriously. The delay may be from hidden damage.,7,09/19/2017,/insideFPL/status/910006541524389888
"During the storm and the time after, we will be posting updates here and on Facebook, but not responding to individual inquiries. Stay safe.",1,09/08/2017,/insideFPL/status/906260854257192961
"2/2 While we fixed the main line, localized damage on equipment may be the issue. Please report on     .",7,09/18/2017,/insideFPL/status/909916699167789058
"when servicing your main line, crews may encounter damage that isn’t visible to you as they’re working in multiple locations.",7,09/18/2017,/insideFPL/status/909843214659653632
"# Irma  restoration efforts underway. No matter how extensive the damage, you have our commitment we will work 24/7 to get your lights back on",7,09/12/2017,/insideFPL/status/907641697986899970
"2/2 If you see a line down and feel it presents a clear and imminent danger, please call 1-800-4-OUTAGE or call 911. Thanks.",7,09/06/2017,/insideFPL/status/905608812001976322
2/3 We also urge you to consider call 911 if you're experiencing a life-threatening emergency.,7,09/17/2017,/insideFPL/status/909495335080341506
1/3 Sorry we missed you. We can understand your concern with the storm approaching.,7,09/08/2017,/insideFPL/status/906142436455583744
1/3 We apologize for disappointing you. We take restoration very seriously. The delay may be from hidden damage.,7,09/20/2017,/insideFPL/status/910397033206484992
"Omar, we’re working 24/7 to restore power by fixing damaged equipment & may have uncovered new damage that may not be visible.",7,09/17/2017,/insideFPL/status/909450755723194369
"2/2 If you're experiencing a life-threatening emergency, please call 911 or call 1-800-4OUTAGE for power-related inquires.",7,09/17/2017,/insideFPL/status/909569529717690370
2/3 We take restoration very seriously. The delay may be from hidden damage.,7,09/18/2017,/insideFPL/status/909732590478925824
3/3 Our Vegetation Management department has suspended all tree and vine investigations.,7,09/06/2017,/insideFPL/status/905424477143654401
2/3 The Nuclear Regulatory Commission requires us to shut down nuclear plants at least 2hrs prior to hurricane-force winds.,7,09/08/2017,/insideFPL/status/906142720678391808
"2/3 We’ve been working to restore service by fixing damaged equipment, and uncovering new damage which may explain delays.",7,09/18/2017,/insideFPL/status/909732091029540864
"We have assembled the largest pre-storm restoration workforce in U.S. history, more than 17,000 hard working men and women. #Irma",7,09/10/2017,/insideFPL/status/906970618041692160
"@ kevincampbellfl  1/3 Good morning, Kevin. We’re sorry to hear about the damages at your property.",7,09/25/2017,/insideFPL/status/912309346452869121
1/2 We apologize again that you are without power. Safety is our #1 priority & please stay safe around hazardous conditions.,7,09/26/2017,/insideFPL/status/912680015808155648
"2/3 Unfortunately, these repairs did not result in your service being restored and is likely due to more localized damage.",7,09/18/2017,/insideFPL/status/909706663896211456
We will not stop working until every customer's electricity is restored.Customers impacted: 4.4 million Customers restored: 1.1 million,7,09/12/2017,/insideFPL/status/907710851246936064
"# UPDATE : West Coast - estimated power restoration by EOD 9/22, possible exception in areas hit by tornadoes, flooding & severe damage.",7,09/12/2017,/insideFPL/status/907615032032333824
"With a storm of this magnitude and intensity, we know that each hour of preparation counts. Please make safety your top priority. #Irma",7,09/07/2017,/insideFPL/status/905853190075273217
"1/3 We understand your concern and safety is our top priority. We'd like to report this for you, but need more info.",7,09/11/2017,/insideFPL/status/907407539536527361
"2/3 We have a record of your outage, and are continuing to work on it. The delay may be a result of damage to our equipment.",7,09/18/2017,/insideFPL/status/909667031108157440
1/2 Irma is the worst storm in FPL’s history & has affected the entire state. We’re doing everything we can to restore power.,7,09/17/2017,/insideFPL/status/909499950563778561
"As #Irma  nears, please prepare and make safety your top priority. See prep tips at     .",7,09/06/2017,/insideFPL/status/905445508398940162
Please report any fallen wires & poles if they pose a clear and imminent danger to you or others. Call 911 or 1-800-4OUTAGE.,7,09/16/2017,/insideFPL/status/909147500015161344
"2/2 Please keep in mind that delays may be from hidden damage, which makes restoration more challenging.",7,09/19/2017,/insideFPL/status/910018720008949761
2/3 We take restoration very seriously. The delay may be from hidden damage.,7,09/19/2017,/insideFPL/status/910323249258647552
"@ MahoneyWilliam  1/2 We apologize for the confusion. While we fixed the main line, localized damage on power equipment may be the issue.",7,09/17/2017,/insideFPL/status/909498692348137472
"Posible excepciones para áreas afectadas por tornados, inundaciones severas y otras áreas de daños severos.  us/907615284135161858   …",7,09/12/2017,/insideFPL/status/907616984283664384
2/4 We urge residents to call 911 if they’re experiencing a life-threatening emergency.,7,09/16/2017,/insideFPL/status/909104969051201536
"Keep safety your top priority, and stay away from downed power lines. If you see a downed power line, call 911 or 1-800-4OUTAGE.",7,09/10/2017,/insideFPL/status/906820401203990528
1/3 Sorry we missed you. We can understand your concern with the storm approaching.,7,09/08/2017,/insideFPL/status/906144714528874496
"As of Wed, we restored nearly 60% of all customers affected by #Irma  & are restoring at a pace of roughly 4:1 faster than Wilma in 2005.",7,09/13/2017,/insideFPL/status/907963703730987008
"No matter how extensive the damage, you have our full commitment that we will work 24/7 to get the lights back on in our communities. #Irma",7,09/07/2017,/insideFPL/status/905871821643423745
2/2 Please call 911 if you’re experiencing a life-threatening emergency. Thank you.,7,09/18/2017,/insideFPL/status/909923857942933509
"Should #Irma ’s worst fears be realized, our crews will likely have to rebuild parts of our electric system. Prepare for outages.",7,09/07/2017,/insideFPL/status/905830364291235840
use caution when cleaning up hurricane debris & vegetation. Stay 10 ft away from power lines.,7,09/16/2017,/insideFPL/status/909227408762523649
"1/3 We understand your frustration. Partial power may be caused by tripped circuit breakers, a blown fuse, or damaged connections.",7,09/18/2017,/insideFPL/status/909704026043936769
1/2 We understand your concern and safety is our top priority.  Have you already reported this situation?,7,09/12/2017,/insideFPL/status/907684131844378626
"3/5 Unfortunately, these repairs did not result in service being restored and is likely due to more localized damage.",7,09/20/2017,/insideFPL/status/910427444498305024
"@ get2wiriamu  2/3 Unfortunately, these repairs did not result in your service being restored and is likely due to more localized damage.",7,09/19/2017,/insideFPL/status/910037487057334272
2/2 Our crews also work around the clock after the storm passes to help restore power as soon as possible.,7,09/06/2017,/insideFPL/status/905578863480250368
2/3 Crews may encounter damage that isn’t visible to you as they’re working in multiple locations.,7,09/16/2017,/insideFPL/status/909252669881163776
1/2 We understand your concern for your safety.,7,09/19/2017,/insideFPL/status/910017863238418432
1/2 We’re working 24/7 to restore power by fixing damaged equipment & may have uncovered new damage that may not be visible.,7,09/16/2017,/insideFPL/status/909083676255948800
"3/4 We're now in the slower part of our restoration process, where we're working on damaged equipment your neighborhood.",7,09/21/2017,/insideFPL/status/911030396061659136
We want to urge safety now more than ever. Call 1-800-OUTAGE (1-800-468-8243) immediately to report downed power lines.,7,09/11/2017,/insideFPL/status/907373326288465921
", report any hazardous conditions if they pose a clear and imminent danger to you or others. Call 911 or 1-800-4OUTAGE. Thanks.",7,09/16/2017,/insideFPL/status/909057536564789248
2/3 The Nuclear Regulatory Commission requires us to shut down nuclear plants at least 2hrs prior to hurricane-force winds.,7,09/08/2017,/insideFPL/status/906142435935477761
"2/3 Unfortunately, repairs didn't result in restoration & is likely due to localized damage that is associated w/ other tickets.",7,09/19/2017,/insideFPL/status/910088725471907842
2/3 We take restoration very seriously. The delay may be from hidden damage.,7,09/18/2017,/insideFPL/status/909931237040705536
"If this is an emergency, please call 911.",7,09/10/2017,/insideFPL/status/907060375656509441
1/3 We can certainly understand your concern with the storm approaching and making preparations.,7,09/08/2017,/insideFPL/status/906220590893281281
"1/2 Yes, we have crews prepared before the storm and are dispatched as soon as conditions are safe to do so.",7,09/06/2017,/insideFPL/status/905578862901424128
3/4 We urge residents to call 911 for a life-threatening emergency. To find a special needs shelter call 311.,7,09/16/2017,/insideFPL/status/909087120559570944
1/3 We sincerely apologize for the inconvenience. Please call 911 if you’re experiencing a life-threatening emergency.,7,09/17/2017,/insideFPL/status/909501460307677185
Please report any fallen wires if they pose a clear and imminent danger to you or others by calling 911 or 1-800-4OUTAGE.,7,09/17/2017,/insideFPL/status/909451129259544576
Don’t be alarmed if you get an automated call from us. We’re reaching out with storm prep info before #Irma  arrives.    ,7,09/06/2017,/insideFPL/status/905551193602129921
"As of this morning, we have restored 70% of our customers affected by #Irma . Our buckets are in the sky & boots on the ground all across #Fl",7,09/14/2017,/insideFPL/status/908389804936744961
"Hi Ayran, we apologize for disappointing you. We take restoration very seriously. The delay may be from hidden damage.",7,09/19/2017,/insideFPL/status/910185720924471299
", while we fixed the main line, localized damage on the lines/transformer may be the issue. Pls report on    ",7,09/16/2017,/insideFPL/status/909082167682244608
We apologize for disappointing you. We take restoration very seriously. The delay may be from hidden damage.,7,09/16/2017,/insideFPL/status/909080046899523584
"18,000+ workers are restoring power - every hour of every day – even as we assess full damage of #Irma",7,09/11/2017,/insideFPL/status/907250096978395136
