Tweet,Category,Date,Permalink
Why is my street ALWAYS one of the last to get power after every storm. Asking for a friend...,6,09/13/2017,https://twitter.com/WolverinesRok/status/907972477078441985
Your house is beautiful. So glad everything is getting better for you and praying for a speedy recovery for everyone else effected.,6,09/13/2017,https://twitter.com/ChalaBrooks/status/907971889095692288
 bit.ly/2wWUwP7 . At least 5 dead in Hollywood from no ac.,2,09/13/2017,https://twitter.com/WsprinklesP/status/907971475357007874
 really about to get chewed TF up ! Prayers out for those 5 elderly people that passed in the nursing home in Hollywood,1,09/13/2017,https://twitter.com/Flomekmuv/status/907971148415107072
   Why has FPL fixed over 60% of their accounts power and Duke Energy is still assessing the damage?,1,09/13/2017,https://twitter.com/LG9550/status/907969689510445057
"It is only rhetoric, but the grid was destroyed byt fallen trees and branches you had years to trim. Only rhetoric",1,09/13/2017,https://twitter.com/jalfman/status/907969564474036224
"Will be running on generator for awhile. Seatle Trail, Palm Coast.  #HurricaneIrma #notmyhurricane ",6,09/13/2017,https://twitter.com/WilVaught/status/907969393480609792
"Your on-air comment about Florida residents wanting to know the status of their power ""now"" is stupid. Everyone, including YOU, be patient!",7,09/13/2017,https://twitter.com/PJSAnkenyIA/status/907969001711599616
I saw a helluva lot more during Wilma and that was an actual category 2 storm that directly hit us,1,09/13/2017,https://twitter.com/KarinGipps/status/907968861080875009
"City of Palatka downtown traffic lights on FDOT hwy still down, huge public safety issue, please make this a priority!",7,09/13/2017,https://twitter.com/CityOfPalatka/status/907968310146412545
"But what if what is online is dead wrong. Can't call, can't email, can't email. What else can we do except tell you since no response",7,09/13/2017,https://twitter.com/kcreedy/status/907968121100800000
Not faster than JEA. They are everywhere! Islands that were under water have power & I don't! I'm not even in a flood zone!,1,09/13/2017,https://twitter.com/NickyFromYulee/status/907967563908468737
I heard if in pocket area not large numbers you are last left side my neighbors have power right side none no trees down no floods,1,09/13/2017,https://twitter.com/nay652_naomi/status/907967471667343360
.  's #nuclear power plants sustained no damage from hurricane #Irma  ow.ly/AnLR30f7Fkd,7,09/13/2017,https://twitter.com/EPRINews/status/907967282688741378
I tried to tell everyone - more ppl would die because of the outages than the actual storm itself   #fixthegrid  twitter.com/davidovalle305 /status/907960190279983105 …,6,09/13/2017,https://twitter.com/NotDrJ/status/907965815944818688
Made it through the storm with only 3 days of no power! Thank you  and ,1,09/13/2017,https://twitter.com/gkholbrook/status/907965696411303936
Warning from  : “This is the time we see the most fatalities not pre-storm or during the storm” #Irma  snpy.tv/2wpudNj,1,09/13/2017,https://twitter.com/PoppyHarlowCNN/status/907965460091617280
You are busy with looking good to press with numbers we have no trees down no flood neighbors on opposite side have power my side don't,1,09/13/2017,https://twitter.com/nay652_naomi/status/907965450167963649
NO power nw 4terr. Power already restored in surrounding areas.FPL website status 0 properties affected. Have we been forgotten? ,2,09/13/2017,https://twitter.com/tinaluv09/status/907965356333047812
"This is on you, #FPL . While you accepted bribes from big businesses, people died.   twitter.com/bbcbreaking/st atus/907963205959524354 …",2,09/13/2017,https://twitter.com/Istillwantapony/status/907964280376578048
 i love how after the storm we had power untill yesterday at noon. I guess it's not broke untill you fix it.,1,09/13/2017,https://twitter.com/OX_Bigly/status/907964151426949120
"Five elderly people have died in Broward because you didn't prioritize their nursing home. Jesus, do better.",1,09/13/2017,https://twitter.com/Carablades/status/907962752022573056
5 dead in Hollywood because of no power. Great job!,2,09/13/2017,https://twitter.com/Tree0819/status/907962517120528384
"Same here in Coconut Creek. 55+ mobile home park, bordering another mobile home park ALL NO POWER. No repair trucks, no emergency anything.",2,09/13/2017,https://twitter.com/BarbaraAnnODel2/status/907962317412986880
Lost all this power from t storm force winds. Fpl cuts corners on infrastructure improvements promised after Wilma and rate increases.,6,09/13/2017,https://twitter.com/wideslapper/status/907962296806363136
I am so impressed how    & other local first responders have prepared and handled #HurricaneIrma,1,09/13/2017,https://twitter.com/Imjessg/status/907962229978484737
In a modern city power cables are buried underground it's time to make the investment  too many service issues,2,09/13/2017,https://twitter.com/amitanc/status/907961369743331328
5 people died in a nursing home because you're poorly prepared- get ready for lawsuits ,1,09/13/2017,https://twitter.com/multisnakeu/status/907961183428382720
"This is the first hurricane to affect our entire state. Usually they are small enough to affect one area, not the entire state like Irma did",1,09/13/2017,https://twitter.com/SeinenNinja/status/907960728119848960
Crazy that U had just as long 2 prepare 4 this storm as we did & u never thought 2 test UR website/call center? #crisisprep #customerservice,1,09/13/2017,https://twitter.com/JamieBKinder/status/907959220838060032
Only experienced tropical storm winds 395:954 to have so many outages proves fpl cuts corners to save money. See results Criminal,1,09/13/2017,https://twitter.com/wideslapper/status/907959021902196736
" I have no power due to hurricane Irma, my transformer blew, no tree damage. Will my power be returned soon?",1,09/13/2017,https://twitter.com/little_laddybug/status/907958486193131520
From tropical storm force winds in 305/954,1,09/13/2017,https://twitter.com/wideslapper/status/907958475803815936
 80% of people that lost power experienced t storm force winds disgraceful,1,09/13/2017,https://twitter.com/wideslapper/status/907958046747512834
 what is the status of tix 3650 created in 9/9? we lost power before the te storm and no updates!,1,09/13/2017,https://twitter.com/iolivier1/status/907956565801660416
 is there major damage to grid west of Turnpike between Atlantic Ave and Clint Moore Rd? Estimated time for repair?,1,09/13/2017,https://twitter.com/alogator/status/907956545484460032
Finally got through on my phone.  took our ticket as an emergency. Thanks for your massive restoration effort!! #IrmaRecovery,7,09/13/2017,https://twitter.com/JamieWalton/status/907956275727790081
Your company is full of it! Where is the massive response we heard about before the storm?,7,09/13/2017,https://twitter.com/FisherMan275/status/907955188006313985
 My service conduit into my house was damaged by Irma and we have no power. What's the process to get that repaired? ,1,09/13/2017,https://twitter.com/FayMichael/status/907954348054921216
 #FPL knew there is a downed power line 4060 loquat AV 33133 & electrified the line twice causing explosions and fire,2,09/13/2017,https://twitter.com/Rafael_T/status/907953997222432768
FPL do not trim trees on line on there own because they get help and aid to do it after storm. Nice work FPL.,6,09/13/2017,https://twitter.com/mwk2040/status/907953858273529857
Do you guys even have real plans for hurricanes?,1,09/13/2017,https://twitter.com/jarredshaffer5/status/907952488392937474
 thank you all FPL and all the electric companies working so hard to get us back up and running after the storm much appreciated,6,09/13/2017,https://twitter.com/sadie2916/status/907950537299124224
" Great job of restoring power to PBC residents! Down to 257,930 out of 739,000 customers!",8,09/13/2017,https://twitter.com/CityGreenacres/status/907947459959287813
"You ordered people to NOT call, then announced you needed people to call because of damage to your system  Tweeting now",7,09/13/2017,https://twitter.com/JamieWalton/status/907947347283468293
Thank you Team FPL for your steadfast efforts to begin the massive restoration effort w/ fellow mutual assistance crews,6,09/13/2017,https://twitter.com/FERCRPowelson/status/907946456706895872
 my block has a nursing home no power for 3 days! But all business and shopping around they have it.,5,09/13/2017,https://twitter.com/natyachida/status/907945643313856512
If you guys still don't have light but no damage around you don't have light because they don't have enough inspectors to go to your area,2,09/13/2017,https://twitter.com/krold88/status/907943765318479872
"Another thing I just heard is that they ran out of transformers, way to plan for a hurricane.",1,09/13/2017,https://twitter.com/josephtc509/status/907943761182945280
"I've been without power since Saturday morning. I was out walking my dog. No storm and ""poof"".  is the worst. 4 days and count",1,09/13/2017,https://twitter.com/dr_fermi/status/907942914961166336
"This was basically a tropical storm , and they say it would take a full week to get power back on the grid . That's such a joke",1,09/13/2017,https://twitter.com/RealBlame/status/907940825279148032
 seems like all your resources are in Miami Dade and Broward. I have not seen 1 truck in the city of Sarasota since the storm.,1,09/13/2017,https://twitter.com/VinMeloro/status/907936234194063360
"#UPDATE :  : More than 444,000 customers without power in Miami-Dade, 317,000 in Broward #Irma #operationstormwatch",8,09/13/2017,https://twitter.com/NatyonAMFM/status/907936076299489280
We live in FL & hurricanes do this. I was chill UNTIL I was told my power was back then couldn't report that it was isn't.,1,09/13/2017,https://twitter.com/rynsweurld/status/907936020829757441
"FPL may try to convince the state that Irma a tropical storm w gusts of 68mph caused millions to go without power, but that's not true.",1,09/13/2017,https://twitter.com/NavKana/status/907933535721402368
You know fpl are already working on lobbyists to get a massive rate increase to cover this. They made $1.65 Billion dollars profit last year,2,09/13/2017,https://twitter.com/ssimpson_steve/status/907933437083967488
"HAH. ""Working to resolve"" one of the larger storms in the past few years, these are the updates we get.3bn state contract in 2015 #monopoly",6,09/13/2017,https://twitter.com/naxsnaxnax/status/907932391393636353
Instead of apologizing you should have predicted that those trees would damage the electric cords so you could prune them in advance.,1,09/13/2017,https://twitter.com/jorilalbima/status/907930702838198272
 FURIOUS. EVERY HOUSE ON MY STREET HAS POWER BUT MINE. REPORTED AGAIN. #hurricaneirma,2,09/13/2017,https://twitter.com/lahtiji/status/907930467588067330
"Hospitals and emergency facilities first. We're all stressed. Stay positive, don't break.",7,09/13/2017,https://twitter.com/bitaof7/status/907928775488401408
 where is power to 33433? A cat 1 storm does this much damage? Why do I keep paying for #fpl to strengthen its grid??? #fplsucks,1,09/13/2017,https://twitter.com/Turning3010/status/907928548043841536
 THOUSANDS of ELDERLY Kings Point residents STILL waiting for a crew. Why aren't they a priority this far into restoration?,2,09/13/2017,https://twitter.com/bleacherbabe1/status/907926179499438080
" A power line was damaged during the hurricane. It was reported. When FPL came, they removed the caution tape and left. Why?",1,09/13/2017,https://twitter.com/Ignite_TI/status/907923569832812545
When everyone around you has power and AC and you got nothing! #hurricaneirma  #hurricaneaftermath #florida #floridapowerandlight ,2,09/13/2017,https://twitter.com/ChristinaHeintz/status/907921721046564864
There's also the fact that these trucks didnt stage and get working until yesterday afternoon. Two days since this storm past.,2,09/13/2017,https://twitter.com/jacob_hamling/status/907915520598577153
#FPL  is working very hard to repair Irma's damages. Thanks FPL #doral #AfterIRMA,6,09/13/2017,https://twitter.com/lealsan1/status/907908118750941184
"Um,what?  is incomprehensibly incompetent!We lost power before the storm, were not hit bad,&still out 4 NO good reason!We r dying!",2,09/13/2017,https://twitter.com/LyndaDaniel1982/status/907905286668787712
You know what's unprecedented? Your corruption & incompetence.Down since 10AM Sunday & barely touched by Irma.Fpl is the worst utility ever,1,09/13/2017,https://twitter.com/LyndaDaniel1982/status/907903247083560961
"Their ""assessing"" the damage",2,09/13/2017,https://twitter.com/sunshinejade98/status/907896804238389248
"Next news headline ""Millions die in Florida...NOT caused by Irma, Cause of death: FPL sucks."",,,,""907894924376502272",3,09/13/2017,
"You have parked 100 trucks by gulf stream park. I live just a few blocks away by 33009 and no power at all, pleaseeeee help",6,09/13/2017,https://twitter.com/silviagabrielam/status/907885949077647360
 so why the hipe about the trucks before the storm SMH,6,09/13/2017,https://twitter.com/diannebaez/status/907853347436277760
" , no one truck on site but a lot of media hipe about being ready before the storm",1,09/13/2017,https://twitter.com/diannebaez/status/907853071560126464
  says safety first? Should see the down line they took from road & threw in yard rather than attach! Punishment! SMH!!,2,09/13/2017,https://twitter.com/KidzCoach/status/907850304342949888
  FPL says safety first? They threw down line in yard that was in street! Why not attach it? Punished 4 calling it in?,1,09/13/2017,https://twitter.com/KidzCoach/status/907847763471323136
"  Thank you to the convoy of electric, rescue and relief workers driving thru the night down FL Turnpike #HurricaneIrma",6,09/13/2017,https://twitter.com/smartcorgi/status/907838633788559363
You provide electricity in FLORIDA! You know hurricanes happen here. Upgrade your tech infrastructure w/ your regular rate hikes!,1,09/13/2017,https://twitter.com/rynsweurld/status/907836322039164933
There's a lot of that going around except the idiots where I live are actually DRIVING on the downed lines #hurricanejackass #FAIL ,2,09/13/2017,https://twitter.com/FloydianSlipped/status/907835362231422979
Now THAT is a great idea. Underground makes a lot of sense. You're right - hurricanes aren't going anywhere.,2,09/13/2017,https://twitter.com/bradthebishop/status/907832344979103745
"Not sure what makes my world cloudy, and I'm certainly not attacking anyone. Just meant to make a case for patience and understanding is all",1,09/13/2017,https://twitter.com/bradthebishop/status/907829039762722817
"Hats off  for restoring our power in just 36 hours! FPL power outages set record, with millions affected  press.sn/2x0dF1N",5,09/13/2017,https://twitter.com/RobMinton2/status/907827740296052737
This is my 3rd night. I see lots of trucks in Broward as unincorporated Miami-Dade waits&wonder if this will be like #hurricanewilma #3weeks,1,09/13/2017,https://twitter.com/strawbewie_305/status/907825940612468736
"yes i'm grateful that nothing serious happened to me during the hurricane, but i need AC to sleep bro  !!!!!!!",1,09/13/2017,https://twitter.com/mariaquin_/status/907825399169785857
Outside with no breeze. My dear that is no decency. Or shall I discuss the nursing home 3 blocks away with no power and bedridden patients,1,09/13/2017,https://twitter.com/ButterflyBlingg/status/907823695003037698
"after hurricane irma, i just have to give a shout out to  for bringing power back so quick to so many homes in FL",6,09/13/2017,https://twitter.com/lucianavee/status/907823435560243200
...yes and people are dying. ...a nurse that cares for the elderly reported 1 death in her community from the heat.,1,09/13/2017,https://twitter.com/RevJets/status/907823219855556608
That happened to friend here in Sarasota. Irma evidently damaged elec box that affected about 14 homes. It was back up in an hr. Good luck!,8,09/13/2017,https://twitter.com/terrijoliefla/status/907820007677157377
"One thing  does well is post-storm repairs, hat tip to the many employees working around the clock! Cant always ""see"" the work.",6,09/13/2017,https://twitter.com/alissajean/status/907817411721744387
I don't understand what's going on in Doral  half of the city doesn't have power but nothing damaged here.. #ICantWithThisHeat,2,09/13/2017,https://twitter.com/CNovakabroad/status/907816295797751808
My #thoughts & #prayers for all Impacted by #HurricaneIrmaAftermath Thanks to  & other crews from around the country #Thankyou,6,09/12/2017,https://twitter.com/USAForFreeCuba/status/907816056504418304
"No power since Saturday, had it 20min yesterday then nothing since. Disabled vet, single mom, bad neighborhood too. #praying #notamused",2,09/12/2017,https://twitter.com/bailarina1017/status/907815103613083649
"Ps. Please excuse the ppl who are in 100F, destroyed homes and flooded cities. Let's all say happy anniv. to u because that's the real issue",6,09/12/2017,https://twitter.com/Ci3ra941/status/907813263026638848
 Voter have to make this a key issue in our state its bad when  more dismay than the actual storm,7,09/12/2017,https://twitter.com/jarael82/status/907812829385969666
 . Where is the large crew you all claimed to have assembled prior to storm three days and I've not spotted any fpl trucks y?,1,09/12/2017,https://twitter.com/tahirandubai/status/907812697449926656
 do we deserve a review into what  has been doing the last 10 plus years to prepare for storms?,2,09/12/2017,https://twitter.com/jarael82/status/907812424727842816
Thank you  &  for doing a great job in preparing for and addressing Florida residents needs #HurrcaneIrma #electricity  twitter.com/abcworldnews/s tatus/906686332973584386 …,6,09/12/2017,https://twitter.com/Emalfarb/status/907812272600502272
"First responders were ready prior to the storm because they care, you weren't because you do not care. Monopoly gives you that power.",2,09/12/2017,https://twitter.com/WaleedAlhrabai/status/907811747511369728
" over the pnyears since last storm, I would like to know what has  done to improve reconnect tech?",2,09/12/2017,https://twitter.com/jarael82/status/907811560688701445
"""Unprecedented"" you mean the other 3 million places you haven't fixed want answers? No way.",2,09/12/2017,https://twitter.com/Ci3ra941/status/907811414760411136
"We spent 3 weeks without power after a tornado in 2008, we had 3 of the largest Electric bills ever in the months following.",2,09/12/2017,https://twitter.com/RandyLayman/status/907810585328398336
in the business. Right now I'm doing storm assessment for Flint EMC here in Ga. I did work Mathew for FPL and some of my coworkers are,2,09/12/2017,https://twitter.com/IamD36/status/907808157086486528
"Full of shit, i havent even seen a truck accessing the damage let alone trying to fix anything",6,09/12/2017,https://twitter.com/Gregoryloving1/status/907807904258031623
Just wait until  charges the customers for the repair cost of this storm! It's already been approved for them to do it.,1,09/12/2017,https://twitter.com/naliniandchris/status/907807711340965888
Twitter feed seems to work just fine...keep it here...& be a little less vague w/ info. Plz.....What damage can it do to give us specifics?,6,09/12/2017,https://twitter.com/ManassehWarrior/status/907806909109035013
This was obviously in reference to hurricane Irma in South FL.,1,09/12/2017,https://twitter.com/NeddyRundle/status/907806354278154240
 where are the trucks?!?!?! #nopower #fplsucks #hurricaneirma,2,09/12/2017,https://twitter.com/MCityComics/status/907805644211806209
Wow! Looks like in the big picture you came out lucky. The home doesn't appear damaged. Biggest battle if so.,1,09/12/2017,https://twitter.com/lovstoplay64/status/907804880039014400
 is there a non-toll free phone #to check on status of outages? I'm overseas and can't use the 1-800 #(app won't work either),1,09/12/2017,https://twitter.com/Silvasonic/status/907804402744008706
I was think that. I am just worried about my daughter and our pets. Daughter just recovered from heat exhaustion incident,4,09/12/2017,https://twitter.com/ButterflyBlingg/status/907804109587324928
Cosas materiales . Now to rebuild !,7,09/12/2017,https://twitter.com/Raultriathlon/status/907803630019006464
Mandatory break for sleep after 16 hrs of humping it. That's for safety reasons,1,09/12/2017,https://twitter.com/IamD36/status/907803547584081920
"Sorry, if you have to deal with that matt. I definitely feel for everyone dealing with the hurricane.",5,09/12/2017,https://twitter.com/VitoMalacari23/status/907803029658894338
No kidding Einstein! Totally disappointed in level of communication and service. Yes a big storm came and you have people but also made $$$$,1,09/12/2017,https://twitter.com/WoofKdog/status/907801473173606400
Maybe you should get your shit together. We live in Florida and we have hurricanes plan accordingly.,6,09/12/2017,https://twitter.com/mhecht79/status/907801243543883776
 the weather is stated to increase and we have no electricity so I guess we ought to bake to death that's the service we pay for,1,09/12/2017,https://twitter.com/simms_thresha/status/907799653311229952
Please last storm we hit updates and they were reassuring,2,09/12/2017,https://twitter.com/cyndilenz/status/907799424528773120
Coral Gables? Hope all the beautiful trees didn't get destroyed.,3,09/12/2017,https://twitter.com/elizabetht2001/status/907798426577862656
And this wasn't even a hurricane. Still #nopower,1,09/12/2017,https://twitter.com/nuckleracketman/status/907797273282793472
Hey  my mom wants you to put all the power lines underground so we don't lose power like this next hurricane #irma,6,09/12/2017,https://twitter.com/amandaluiso/status/907795698644606976
FPL CEO and Board members will be held responsible for the deaths of 2 hamlet cc residents in Delray. Homebound seniors need air!,1,09/12/2017,https://twitter.com/BrianChickloski/status/907795528347471874
 What if #Irma would have impacted us as the cat 5 storm it first was?,1,09/12/2017,https://twitter.com/1captainsgal/status/907794106792980480
Our PG&E guys restoring in Florida from Irma. #pgewives #ibew1245 #mutualaid #florida #hurricaneirma ,7,09/12/2017,https://twitter.com/PGEWives/status/907794009787047936
Every light on Atlantic has power except the hamlet drive street light. Average age of 92 years old. How many more deaths to come?,2,09/12/2017,https://twitter.com/BrianChickloski/status/907793553895587840
Thank you God? It's the hard working FPL having to fix up the trail of destruction that God didn't bother to prevent in the first place.,6,09/12/2017,https://twitter.com/AdvKiwi/status/907793158179659776
Power on sone blocks right next to them . FPL is responsible for thes deaths due to mismanagement,1,09/12/2017,https://twitter.com/BrianChickloski/status/907793050285592576
  Monroe Cnty suffers more storm damage and power is sustained in many cases. Why can't Miami have the same? #Irma,1,09/12/2017,https://twitter.com/1captainsgal/status/907792442602262529
"Thank you  for all your hard work!! The whole state of Florida was impacted, you're doing the best you can! #godblessyou #fpl",6,09/12/2017,https://twitter.com/kristinnallenn/status/907791828975603713
Ana your truly luck your house wasn't destroyed by falling trees,5,09/12/2017,https://twitter.com/girolamo5151/status/907789768234119168
 you recovered power for 1900 plus in our neighborhood and left 140 of us without. Then removed ticket. Wtf?,1,09/12/2017,https://twitter.com/DaveSell904/status/907788706324643841
hurricane hit with MUCH less power than originally forecasted. Also love how ppl in gated fucking communities got their shit back already.,1,09/12/2017,https://twitter.com/RogueWand/status/907787468480684035
It takes organization & communication to help communities recover from #NaturalDisaster    Info saves lives  twitter.com/pecoconnect/st atus/906896017496387584 …,3,09/12/2017,https://twitter.com/JoanDetz/status/907787241573011457
"  East of me, power. West of me, power. Me? Still, NO power since 9/9 am. Before the storm! #HurricaneIrmaAftermath",2,09/12/2017,https://twitter.com/luly10/status/907787152116867078
"Don't get how  runs ads about investing $3 billion to ""harden"" their system yet post #hurricaneirma we STILL have no power. The",1,09/12/2017,https://twitter.com/RogueWand/status/907787051675914240
"Unreal,Flip the switch!!! It was working for 8 hours post storm and you shut it off. Yet power all around??? C'mon man",6,09/12/2017,https://twitter.com/S_Wolf67/status/907787029232209921
Your website is now down ! Who is paying displaced hotel room ! It's 95 degrees in my he apartment and it's maddening to see others have,2,09/12/2017,https://twitter.com/swimfan2/status/907786747697922049
I don't even tweet but I got on here to give y'all a fair warning next step I'm writing JAMES ROBO on everything YALL CEO ,1,09/12/2017,https://twitter.com/shatorriab12/status/907786518323965952
"FPL is a total disaster, why discriminate with Coral Springs?  ",3,09/12/2017,https://twitter.com/petej64/status/907784638634102784
Fpl is catering to business accounts power turned off in poor neighborhood prior to storm! Fpl fakes numbers,8,09/12/2017,https://twitter.com/trykeepingup/status/907783888067551233
You turned off power in poor neighborhood prior to storm and now rushing to turn lights on to upperclass..,6,09/12/2017,https://twitter.com/trykeepingup/status/907783088452898816
2 trucks all week in our neighborhood as though we don't really matter. We barely had any damage and no power for this long?,1,09/12/2017,https://twitter.com/My3SonsFL/status/907782948744826880
