Tweet,Category,Date,Permalink
 You should reduce the bills to those affected without electricity by Hurricane Irma in Florida.,6,09/14/2017,https://twitter.com/magodiesan/status/908437426426785792
My neighborhood got power today one thing we would not make it in attack on our country grid system I was so hot I couldn't talk to people,2,09/14/2017,https://twitter.com/nay652_naomi/status/908436861437259776
"I think everyone who lost power, especially those who repeatedly lose it evy storm, should not pay bill in Oct. Shutting eveeyone off?",1,09/14/2017,https://twitter.com/RobinBorgognone/status/908436031397072899
"86 yo on one side of me & 82 yo on the other. Neither in good health & no place to go. Come on FPL, maybe fix the street? Happens evy storm.",2,09/14/2017,https://twitter.com/RobinBorgognone/status/908435573282664448
But the $$$ that #FPL pours into the FL Leg guarantees they'll keep trying to frack FL & leave cust to die in storms  miamiherald.com/news/politics- government/state-politics/article139248918.html …,2,09/14/2017,https://twitter.com/anatinsly/status/908432330133471234
#FPL prohibits customers from accessing their own solar power during a storm. But it refuses to bury its lines bc $. And instead of moving +,1,09/14/2017,https://twitter.com/anatinsly/status/908423511542296581
  we are waiting anxiously for #Power workers in #BISCAYNEPARK hope it's not a repeat of 2005 #hurricaneseason,1,09/14/2017,https://twitter.com/molldenmia/status/908422202571345926
"I have a thousand residents, many seniors, in six buildings all around me with no electricity. Not an FPL truck in sight.  6days.",2,09/14/2017,https://twitter.com/TruckChampion/status/908421600650911744
#FPLOutage  #help #irma 110 patients evacuated from N. Miami Beach assisted living facility with no power  local10.com/weather/hurric ane-irma/110-patients-evacuated-from-n-miami-beach-assisted-living-facility-with-no-power …,2,09/14/2017,https://twitter.com/GoofyKerr/status/908421070939672577
 just got bill dated 9/11 though hurricane on 9/10 includes storm charge and is more than other bills. No one to contact ,1,09/14/2017,https://twitter.com/sjs0069/status/908420993160482822
Come on  where are you guys children and elderly suffering! You knew about storm for weeks and had 12 years to prepare! Wtf! #nmb ,6,09/14/2017,https://twitter.com/goldstocktrades/status/908420876969930753
We made cards to thank the people working around the clock to restore power to Floridians.  #hurricaneirma #kindness #patience ,6,09/14/2017,https://twitter.com/CarlaDuval305/status/908420122418778113
 I am trying to be patient but my family is at risk. This heat is deadly and we cannot do anything. Church St 34275. Do something,1,09/14/2017,https://twitter.com/lizzyshoben/status/908417152335695872
"Most of the comments from residents are that they haven't seen  trucks, ask for investment in underground power lines.",1,09/14/2017,https://twitter.com/LDixon_3/status/908414474675195906
"natural disasters happen, but we live in FL hurricanes are part of the package, shouldn't we have stronger elec. infrastructure",7,09/14/2017,https://twitter.com/Yfonseca17/status/908413485901545478
"My area was barely affected yet we have not had power in 5 days, yet everyone around us does. Can FPL please explain this",2,09/14/2017,https://twitter.com/Yfonseca17/status/908413235497504768
"When FPL rates have been increasing steady throughout the years, to prepare for a storm, we barely got hit by a Cat 1 winds, and still no el",1,09/14/2017,https://twitter.com/Yfonseca17/status/908413012477915137
A rep from  is giving updates. He said two crews are working with Gables fire rescue to clear trees and power lines,3,09/14/2017,https://twitter.com/LDixon_3/status/908409602051645448
"Yay, I hope you all get the help you need. Hurricane victims are in my prayers.",5,09/14/2017,https://twitter.com/JadeStonegrl/status/908409422149328896
"With you, worst part is they're still assesing the cause of the damage. We need better transparency!",2,09/14/2017,https://twitter.com/OccupyIND/status/908407830839009282
"If fpl intentionally knows its blocking the only exit and we cant leave, is the death of us on their hands? No electricity to pump water.",2,09/14/2017,https://twitter.com/EdLee5FLA/status/908406148386181128
The farmworker community at South Dade Center have had no power since #Irma & have been dealing w/ extreme heat & flooding. ,5,09/14/2017,https://twitter.com/WMW_Florida/status/908405682860371968
"More than 21,000 have descended on Florida in the largest storm deployment in U.S. history, according to   goo.gl/tXsrgG",6,09/14/2017,https://twitter.com/SNNTV/status/908405001927630849
"I am glad you are certain of that. Apparently,  has no issue answering & they are overwhelmed. A massive monopoly can do it too",6,09/14/2017,https://twitter.com/carlitaswaynmia/status/908403184560951296
96 hours and counting with no power....33312. We are baking to death...,2,09/14/2017,https://twitter.com/Stardust_Rogue9/status/908402550717763584
You said my power is restored. It isn't. I don't want a new ticket. My power has been out for over 90 hrs. #hurricaneirma ,2,09/14/2017,https://twitter.com/DixieBecca/status/908402100484427777
The incompetence was the administratof of nursing home!those patients should have been evacuated much earlier!,1,09/14/2017,https://twitter.com/wisdomfromage/status/908402025918017538
Have been through 3 hurricanes and ensuing loss of power/water. Can't say enough about how quickly  had us restored,6,09/14/2017,9.08398389783613E+017
Do u kno when Potomac Ave will be up and running....lights are on on military trl north of Forest Hill but not on our street....,4,09/14/2017,https://twitter.com/Palm_Beach83/status/908396529039364096
"There still are famines!!!!! There are still droughts, wildfires, blizzards, hurricanes. There always will be!",5,09/14/2017,https://twitter.com/Shilohv1955/status/908395675750088704
"Much gratitude to law enforcement,  everyone clearing roads & power companies who came to help. #IrmaHurricane #IrmaRecovery",6,09/14/2017,https://twitter.com/KENDALLKUBAN/status/908395073729167360
"I just wonder WHY after 1/4 century of rate hikes & storm lessons 2 'modernize' grid, power, cable & phn grids r still so 19th Century?!",1,09/14/2017,https://twitter.com/RealMiamiEstate/status/908392662537003014
"THNX...just wonder WHY after 1/4 century of rate hikes & storm lessons 2 'modernize' grid, power, cable &phn grids r still so 19th Century",1,09/14/2017,https://twitter.com/RealMiamiEstate/status/908392437504233472
"Just want to thank  for their work in Irma's recovery! Ditto for  ,  and everyone else involved!!",6,09/14/2017,https://twitter.com/CatsupyCat/status/908392014772883463
"Well, we could take out every tree on the planet! Cannot protect power poles and lines from 140mph winds & floods!",7,09/14/2017,https://twitter.com/Shilohv1955/status/908391434138423297
"Hey,  , many homes in E. Hollywood still without power. $2 Billion spent on storm hardening after Wilma. What gives? #Irma",1,09/14/2017,https://twitter.com/GeorgeCavros/status/908390360484892672
 how many more deaths do you want to be responsible for..elderly mother needs electricity to run her oxygen..no one has been,2,09/14/2017,https://twitter.com/he1p1m1ost/status/908390135330492417
People educate yourselves and realize fpl put billions into prepping for major storms. So why a cat 1 has people with no power for days ????,2,09/14/2017,https://twitter.com/Bigg_Snuff/status/908389513449426945
 Wow! A few hours after the storm they went out to assess the damage? #crisisaverted #FPLdisappoints #PRnightmare #lies ,7,09/14/2017,https://twitter.com/Tessietessler/status/908389006739636224
"We're proud to support  with #Irma storm recovery, while also serving our customers in PA. Here's a pic from the Fort Myers area. ",7,09/14/2017,https://twitter.com/PPLElectric/status/908388604665384961
" #fpl sucks. Where is power to 33433, no tornadoes, barely a cat 1 storm, no power for five days and counting. #fplsucks",1,09/14/2017,https://twitter.com/Turning3010/status/908388133577916419
 I still don't have electrity since Saturday and the hurricane didn't even land in broward county #fpl #useless #greedycompany  twitter.com/jerryiannelli/ status/908385753683685376 …,2,09/14/2017,https://twitter.com/mariobros_88/status/908386583644164102
"gulfstream estates in hallandale no electric, fpl trucks park  one block away as a hub, and pass our house 5 days straighr",2,09/14/2017,https://twitter.com/ltchabad/status/908386576459235335
"Yup, aware of that, which is why I am protesting it. PR dept should b responsive, reassuring, proactive.  sent rescue #proactive",1,09/14/2017,https://twitter.com/carlitaswaynmia/status/908386147159638016
there's a tweet pinned to the top of their twitter feed that lets everyone know not to expect responses during & after the storm.,1,09/14/2017,https://twitter.com/mspatricia317/status/908385602126716929
"I really hope that's not true. If that's true, then riots might be imminent. After all, people in American have rioted for stupider",1,09/14/2017,https://twitter.com/JoeyBagODonuts8/status/908384423762161664
not going to wait anymore send all the trucks you have parked in gulfstream send everyone to every neighborhood we cant/wont wait till sun,6,09/14/2017,https://twitter.com/kevinco53255708/status/908383769664651269
"When you figure out how to stop trees from falling during hurricanes, let us all know.",6,09/14/2017,https://twitter.com/Shilohv1955/status/908383680401260545
More deaths to come on the hands of FPL! Hamlet cc in Delray average age 86. No breathing machines!,2,09/14/2017,https://twitter.com/BrianChickloski/status/908383438012633089
"I lived through Andrew and many places took weeks to get power back . Andrew was stronger but 1/4 size of Irma , so 4x destruction statewide",5,09/14/2017,https://twitter.com/bama4me2/status/908381898304573441
"We have the same questions, but authorities are not yet revealing details on staffing at the nursing home.",2,09/14/2017,https://twitter.com/epesantes/status/908379702213083136
5 days W/O. SW 140TH AV & 166TH ST 33177 blocks of houses affected,2,09/14/2017,https://twitter.com/slp921/status/908378579905458176
 you must be kidding? This must be the first hurricane this company has been thru smh ,1,09/14/2017,https://twitter.com/PetePearl/status/908376984090234881
"When a major hurricane hits, having power out for a week is not uncommon. When the storm hit all of FL, expect it, part of being Floridian.",1,09/14/2017,https://twitter.com/EnsellJudith/status/908373747232583683
Our ticket was created day of storm and “completed” overnight saying we all have power. WE DO NOT HAVE POWER. Had to create new ticket.,1,09/14/2017,https://twitter.com/nayrelyk7/status/908372501910233089
"For 15 years slightest wind knocks out power there. Crews come and patch it up, but stays the same. good thing it was only TS not hurricane",6,09/14/2017,https://twitter.com/fasterword5/status/908370360030162946
Can i have a BILL relief...? like from  ?  twitter.com/lyft/status/90 7319842465656832 …,6,09/14/2017,https://twitter.com/msiguess/status/908370331487887362
 Crews Tuesday cut back trees and repaired damaged lines but haven’t turned them back on yet? Ticket: 4764,1,09/14/2017,https://twitter.com/AVonGauss/status/908370138503802880
Disastrous response. Shameful. Homes are now been destroyed from mold and pest infestation because of no A.C.,2,09/14/2017,https://twitter.com/john_e_01/status/908369030913970176
I guess   will finally have to address no electricity in East WM nursing home after 8 dead in Hollywood NH. ,2,09/14/2017,https://twitter.com/brice4paradise/status/908366392289890305
 Shoutout for getting my parents power back on!! Thanks for your work helping those affected by Irma #HurricaineIrma,7,09/14/2017,https://twitter.com/lisaccoffey/status/908365386319527937
22nd??? Everybody would be dead by then!!! #HEATstroke #miamiHEAT  #POTUS HELP MAGA,2,09/14/2017,https://twitter.com/BTW_LOL/status/908362618724864007
 is open and offering 25% off to  employees and first responders. #delraybeach ,1,09/14/2017,https://twitter.com/delraychamber/status/908360816596058112
we were out 10 days during hurricane frances... could be a long road,7,09/14/2017,https://twitter.com/clairemetzwesh/status/908358888054980608
Post-Irma nursing home tragedy sets off alarms across Florida - CBS News if it’s not an easy fix  moves on  apple.news/AeBKSu7huQ_Kb0 z_uLsZ_4w …,1,09/14/2017,https://twitter.com/jaymeninno/status/908358004214550529
I work in rpb. No excuse for no power. The storm was not bad here. I live n wpb still no power.,1,09/14/2017,https://twitter.com/Keith_MuckDawg/status/908355762208038914
Yes!! Yes it is!  please find my house! #prayingforpower ,2,09/14/2017,https://twitter.com/nsdiehl1023/status/908355632285274112
I heard that downed power lines were a priority. Duringstorm i called 911 and my mom called fpl a few hours later on 9/10.no power yet day 6,2,09/14/2017,https://twitter.com/ghost_of_ghost/status/908353353876332544
 has been the real MVP since this storm hit! Finally starting to get power back a lot of places,1,09/14/2017,https://twitter.com/taraalynneee/status/908352869325254657
 just lost power in the 33134 zip code. Can't report it since original storm ticket still shows up. It was restored yesterday,4,09/14/2017,https://twitter.com/GerryFernandez8/status/908352488394371074
"How is possible that they will restore power until sunday at 11 pm, if my didn't suffer any tornados or flooding! What kind of sick joke ! ",1,09/14/2017,https://twitter.com/JoseChelemanuel/status/908350655840096256
Still no pwr 5 days after #Irma and we only had tropical storm weather. Thought you were ready for an intense hurricane ,1,09/14/2017,https://twitter.com/Its_LidiBaybayy/status/908349736880668672
Also  has worked diligently to upgrade the infrastructure. They have come a long way since 2004 hurricane season.,2,09/14/2017,https://twitter.com/PersisterGail/status/908349494114349056
Another PSA for   and other #HurricaneIrma recovery workers in Central Florida ,2,09/14/2017,https://twitter.com/adriennecutway/status/908349241831108608
 senior citizens/residents at The Terraces at Bonita Springs need power! Please help,2,09/14/2017,https://twitter.com/ConsAmericanOrg/status/908348524160540673
" needs to inform. Platitudes, advice and BS don't get my power back on. Let me know what's going on. Understand lots are affected.",2,09/14/2017,https://twitter.com/daveonuevo/status/908347879084916736
FLP has killed more people than irma did.. they restore power to casinos instead of nursing homes. Bravo fpl good job,3,09/14/2017,https://twitter.com/Pornstrlover305/status/908347821698547712
"I'm in Miami, I got power back at 3:00 am today, Thanks    and  which patrols during hurricane!",6,09/14/2017,https://twitter.com/Frank4USA/status/908347391602028544
FPL has all these customers and never enough man power after a hurricane,1,09/14/2017,https://twitter.com/BryceSomething/status/908347290955415552
Ain't no way some one should be w/o power 4 5days in 2017 smh natural disaster or not...y'all are truly trash ,2,09/14/2017,https://twitter.com/Dont__BeStupid/status/908345904415100930
your bill is forpowerused beforethestorm men came from other states to get our power on across the whole state be humble others r worse off,1,09/14/2017,https://twitter.com/DoggieStyles101/status/908345747749425152
Near high school. Pretty bad. Tree and power line damage and flooding. High water. Hope her place is ok. #foodtrucks #naples #IrmaRecovery ,5,09/14/2017,https://twitter.com/pattigenko/status/908345687934369794
We’ll share request with our Marketing team. Please know we’re working with the Red Cross to help provide relief to Irma and Harvey victims.,7,09/14/2017,https://twitter.com/RealLunchables/status/908345637112086528
They want more people to die ! So far 8 elderly people died of heatstroke !,1,09/14/2017,https://twitter.com/Lucifur665/status/908344712888807424
"Our home power status w/  downgraded from ""crew arrived"" to ""under investigation"" to ""sometime b4 11:45 pm Sunday"". #Miami",1,09/14/2017,https://twitter.com/And_Ampersand/status/908343039147606021
My hero to the rescue!  #fplsquad #miami #postirma …  instagram.com/p/BZBoG17F6T8e 7MV42HL3L8bQhqhW7XgZ-0cWwQ0/ …,2,09/14/2017,https://twitter.com/ingridmarie1/status/908342297720508416
My house still has no power from this storm  pls hurry up,2,09/14/2017,https://twitter.com/maddymoreiraa/status/908342001455779840
Lots of these nursing homes stink. Families have to be on top of them. The staff must be watched But  SHAME ON YOU.,1,09/14/2017,https://twitter.com/nanalerner/status/908337704634654720
All 55+ communities should be on priority list for  to restore immediately after storms. are on day 6 with no power. ,6,09/14/2017,https://twitter.com/supersancheezy/status/908337176890548224
"That looks like mine, but customers affected is 1,927.",2,09/14/2017,https://twitter.com/Salonas1031/status/908336840020828160
 we haven't seen any crews in homestead. No one even assessing the damage. Please advise.,7,09/14/2017,https://twitter.com/jmjasani/status/908336789533843457
Yes all that bragging about how prepared they were and the historic amount of emergency workers ready to go after the storm passed,6,09/14/2017,https://twitter.com/clarkz71/status/908336353900982275
"Sadly FPL dnt care. Thats not a tragedy for them, that's just a minor inconvenience. I am with you on their safety, but FPL dnt care",6,09/14/2017,https://twitter.com/JoeyBagODonuts8/status/908335945199562752
"Did you delete the old one, and send an automated response then not explain Why? Hour 85, no power, just jokes. FPL, this is a disaster.",2,09/14/2017,https://twitter.com/PaulSterling13/status/908332602603524096
Was  ready for the storm? Their outage reporting system malfunctned  poss time. Your thoughts? #HurricaneIrma #southflorida,1,09/14/2017,https://twitter.com/FlashRestoreFla/status/908331544552632321
Was  ready for the storm? Their outage reporting system malfunctned  poss time. Your thoughts? #HurricaneIrma #southflorida,1,09/14/2017,https://twitter.com/HazMatFlorida/status/908330587953516547
Still no power 6 days now. 33435 everyone around us has power. WTF ? Did you forget about us? Say your still investigating the damage,1,09/14/2017,https://twitter.com/mailman26165/status/908330086427971584
Thank you! We hope you are all safe and without major damage after the storm.,6,09/14/2017,https://twitter.com/CypressRx/status/908328548158623745
What's your answer to losing power SAT b4 storm-in Delray?,1,09/14/2017,https://twitter.com/JulieMeryl09/status/908328360417390592
  Where's reinforced infrastructure u promised w/rate increases? This was only tropical storm #HurricaneIrma Aftermath,1,09/14/2017,https://twitter.com/DebbieRFischer/status/908328210940776448
" I'm not saying y'all aren't doing your job, I'm saying y'all need to redefine the word ""priority"". Because a nursing home is one",6,09/14/2017,https://twitter.com/marciteaches/status/908327383895343105
I feel for you brother. It's absolutely shameful and I hope their are inquiries or an investigation after this,3,09/14/2017,https://twitter.com/OG_MP95B/status/908326851747213312
NYT scrutinized  alleged lack of response at deadly nursing home. Now this.  twitter.com/maryannbatlle/ status/908324030561837062 …,2,09/14/2017,https://twitter.com/ArekSarkissian/status/908324419961049088
  One utility provider & five days no power 4 mere tropical storm. What if cat 5 hit us? UNACCEPTABLE #HurricaneIrma,2,09/14/2017,https://twitter.com/DebbieRFischer/status/908322890512257024
 west park! 32nd Ct!!!! PLEASE FIX! this heat is life and death!,2,09/14/2017,https://twitter.com/LadySamandre/status/908322404430163968
Beginning day 4 of cleanup/no power. Prognosis from  isn't good but know they're trying.,2,09/14/2017,https://twitter.com/SteveSWFL/status/908321837439967232
Not sure what that means. Can tell you have never lost power and only lost ATT after storm.  gives no updates like ,1,09/14/2017,https://twitter.com/bferguson73/status/908320939858956288
".  Please send  to Pine Ridge Estates in Naples, FL. These residents are being ignored & YOU DON'T want to ignore them.",2,09/14/2017,https://twitter.com/CaitlinReagan/status/908320485481615360
.  These residents (many of whom have supported your campaign efforts) haven't seen a single  truck in sight....,1,09/14/2017,https://twitter.com/CaitlinReagan/status/908320110129106944
"This is next to a hospital. Once pwr out and no generator-there ""should"" have been an evacuation after storm subsided. Criminal charges????",2,09/14/2017,https://twitter.com/LydiaHluvsdogs/status/908319572708794368
".  Without power, these residents have no water & now septic tanks are backing up causing a health hazard. Please send trucks!",2,09/14/2017,https://twitter.com/CaitlinReagan/status/908319484959739905
Good morning.   please advise the number of springs residents pending to have power restored,1,09/14/2017,https://twitter.com/fernjrodriguez/status/908315944317005826
Still without power day 5 now in lansford ave Port Charlotte. Not seeing visible damage but 48 people without power.,2,09/14/2017,https://twitter.com/LindaLouis19/status/908313915850936320
They'll never commit to anything other than meaninglessly broad deadlines. They don't care. Not like we're going to anyone else for power.,2,09/14/2017,https://twitter.com/atomish/status/908313215318315008
#FPLOutage  Knollwood ave underground wires no damage why no power across and around corner all have power,2,09/14/2017,https://twitter.com/flightattend21/status/908312138699112449
#HurricaneIrma affected us - Our old place is uninhabitable & we need power in our new place    twitter.com/kissmyjunkmail /status/908300734084546560 …,2,09/14/2017,https://twitter.com/kissmyjunkmail/status/908302868935008259
      St. Augustine nursing home without AC raises c  news4jax.com/weather/hurric ane-irma/st-augustine-nursing-home-without-ac-raises-concerns …,5,09/14/2017,https://twitter.com/LeslieJean0104/status/908300536834920450
Would be nice to see numbers from  #afterirma #irma #hurricaneirma  twitter.com/dukeenergy/sta tus/908023334465544192 …,3,09/14/2017,https://twitter.com/EugeneRamirez/status/908300401379872769
Hey  ...I thought downed power lines were a priority due to safety reasons. No FPL trucks in our area. What gives? This is unsafe! ,2,09/14/2017,https://twitter.com/TrojanNemo/status/908298459890974720
"89 degrees in the house ...but everyone around us has power no downed lines, or at holes or damage just no power",1,09/14/2017,https://twitter.com/marissameringue/status/908292143793545216
   give authorization to Atlanta power company to help us! 95+oF our area houses first responders!,1,09/14/2017,https://twitter.com/gmponte/status/908291992177790977
Way to go  for making death seem preferable to enduring this Florida heat.,6,09/14/2017,https://twitter.com/TheWaterboatman/status/908291722353967104
 night shift after #hurricaneIrma . I hope this they were going to ny house!!! ,5,09/14/2017,https://twitter.com/Mali_R/status/908290986681552896
Every store & neighborhood has power except mine. There r no trees down.No flooding. Trucks came said it would b up in a few hrs. 2 DAYS AGO,8,09/14/2017,https://twitter.com/Grouchosauras/status/908290547022012416
 Crew came out and told me the line to the house is damaged. No repair timeline.Marked work order complete online.Still no power!,2,09/14/2017,https://twitter.com/82ndABNVET/status/908289711130730496
.  Thank you for braving the aftermath of #Irma & restoring our power so quickly. Grateful customer.,6,09/14/2017,https://twitter.com/Valeska_VVV/status/908289520700928000
 still no power in 33433. #fplsucks . Competition and investigation needed. Where is Pam Bondi's big mouth now?,4,09/14/2017,https://twitter.com/Turning3010/status/908287774192799744
Oh please no truck in sight with live wires in front of a house in Highland Lakes!! That you don't come for #deaths#blameFPL!!!!!,2,09/14/2017,https://twitter.com/dinarosenblat/status/908284438949359616
We are going to cook to death. Please restore our power. 33312. 90 hours and counting... #FPL,2,09/14/2017,https://twitter.com/Stardust_Rogue9/status/908280523130318848
Yikes!  operates nuclear reactors and you can't handle a little hurricane! Who oversees you guys!  scary! Time to move!!!,1,09/14/2017,https://twitter.com/goldstocktrades/status/908270740901912576
  12 years since Wilma plus millions taken from customers to improve grid and they can't get power on after mild hurricane,2,09/14/2017,https://twitter.com/goldstocktrades/status/908267026304700416
"We need power! It’s been days since storm, yet others have it. FIX IT. Monopolized companies & lying to customers?! I smell your bs & a suit",7,09/14/2017,https://twitter.com/1SuperLoyal/status/908261608396398597
"You must prioritize senior facilities and communities,  We need better regulations for better hurricane preparedness ",2,09/14/2017,https://twitter.com/Haikatrine/status/908251586836811778
"Thx for the speed and dedication FPL et al. Eagerly waiting for this damage and repair period to be history. Stay safe, everyone!",6,09/14/2017,https://twitter.com/GodUWish/status/908249739245838336
Why does a carpet store have power before residential areas? I'm a police officer... guess I'll keep wearing dirty uniforms. #FPLOutage,2,09/14/2017,https://twitter.com/beyondbloodpc/status/908233060453371904
