Tweet,Category,Date,Permalink
I have called everyday since the hurricane made landfall. Nothing.,2,09/17/2017,https://twitter.com/ShireenSandoval/status/909488095178792960
Where in S.Florida? Y should GIVE RELIEF to victims of #IRMA S. FL still no power in many areas!  should compensate! WHAT PHOTOS?,2,09/17/2017,https://twitter.com/SURVIVOR_NO1/status/909486506263371776
"I can see the damaged powerline, plain as day. It's sunny outside, can you send someone to work on this very clear problem? Lee county",4,09/17/2017,https://twitter.com/poisonmariie/status/909486145217732610
"If only #FPL had maintained old copper wires, old outdated poles, buried lines and stop over paying Executives we all would be better off.",3,09/17/2017,https://twitter.com/bitchinabouthis/status/909483583668178944
 How does it feel to have killed 8 elderly people. I hope they have litigious survivors.,3,09/17/2017,https://twitter.com/mygaffer/status/909483307624054784
Six of us have NO POWER Still. all around us have power. transformer blew during the storm 2254 Edgewater Dr. WPB 33406 Help ,2,09/17/2017,https://twitter.com/RemainStoked/status/909482368960000000
Six of us have NO POWER Still. & everyone around us has power. The transformer blew during the storm 2254 Edgewater Dr. WPB 33406 Help!!,2,09/17/2017,https://twitter.com/RemainStoked/status/909481967913226241
U SHOULD GIVE AT LEAST $300 for food/loss of wages to victims of #hurricane #IRMA none of this receipt/photos BS from  or #DCF,1,09/17/2017,https://twitter.com/SURVIVOR_NO1/status/909481496515313664
"Thanks to  , Florida hurricane victims cannot use their own solar panels when the grid is down Capitalism!  bit.ly/2jAC4X9",1,09/17/2017,https://twitter.com/abowersock/status/909480664751329280
"   has someone forgot  ? Mold, bugs, no food, illness, & no UPDATE.  patch.com/florida/fort-m yers/amp/27264152/hurricane-irma-aftermath-power-outages-linger-residents-share-storm-memories …",5,09/17/2017,https://twitter.com/1bunni4me/status/909477650510565376
Day 8 with no power cause of #hurricaneirma  Please help me!!! My zip code is 33334 Please hurry!!! I just can't!!!!! #FPLOutage,4,09/17/2017,https://twitter.com/227_shells/status/909474240163926018
 Why are Florida residents not permitted to use their own solar panels to power their homes???,1,09/17/2017,https://twitter.com/AnonWithAReason/status/909472002054017025
 thank you for your preparation 4 hurricane Irma. Thank you for bringing in ppl from other states 2 restore power. Very thankful,6,09/17/2017,https://twitter.com/v_saintus/status/909469966465929218
I cant believe this is America the first world country. What if we have hurricanes every week? Would we live in the dark forever. SOLUTIONS?,1,09/17/2017,https://twitter.com/iceearth9/status/909467181771042818
 can u get more answers about when the elderly in downtown Naples will have their power restored? 7 days w no real deadline is long,2,09/17/2017,https://twitter.com/dawnperotti/status/909466492814741505
 care to explain how this is even remotely acceptable? Your corporate personhood needs to catch a case of death  ,3,09/17/2017,https://twitter.com/Skjaastad/status/909461776424677377
"Belen area again w/o power that came,back Weds #WTH  I just replaced $250 spoiled food! #Irmaaftermath  twitter.com/wsvn/status/90 9435538259791872 …",6,09/17/2017,https://twitter.com/AFuentesArt/status/909451848670744576
Hey you just created a huge life safety issue. Power went out at our building and now no one can get out of the building.,2,09/17/2017,https://twitter.com/rizlack/status/909451519795310592
"Sorry 2 hear that.  said they were ready for possible cat 5 aftermath, but weren't even prepared for the tail-end of a cat 2. #SMH",1,09/17/2017,https://twitter.com/GroddLy/status/909450983360614400
"Aren't you supposed to give local estimates after 96 hours post-landfall, as per your own stated policy?",1,09/17/2017,https://twitter.com/atomish/status/909449713086279681
miami-dade fire truck just pulled up. probably someone passing out in this heat. #nopower #noAC #northmiami #hurricaneirma ,2,09/17/2017,https://twitter.com/miamibully/status/909449310579904512
over 4 million customers w/ power restored<1 wk after Irma's landfall. Monumentally Impressive  . Silly lawsuit by  ,8,09/17/2017,https://twitter.com/MisterCommodity/status/909446854106075136
" is causing a financial crisis in Miami for years to come! Very incompetent company, 9 d no power and I have underground wires  twitter.com/wsvn/status/90 9435538259791872 …",1,09/17/2017,https://twitter.com/anaraquelfe/status/909444398634749952
"Power ret'd SOONER after Wilma(3), than T. Storm winds w/gusts. Tree on roof + power line-8 days causing more damage. Can't remove or would!",2,09/17/2017,https://twitter.com/milhealth/status/909442826584420352
And we only got a few tree damages and what not and we can't get no fucking power here in Golden Gate??? Come on man this shit absurd,2,09/17/2017,https://twitter.com/Oscb0ng/status/909442500947038208
Ppl are showing videos and pics of thousands and thousands of trucks and they ain't doing shit.. Bonita springs is still fuckin flooded(1/2),6,09/17/2017,https://twitter.com/Oscb0ng/status/909442299473616896
Your lobbying prevents FL families from being able to use solar even in state of emergency. Shame on you all,1,09/17/2017,https://twitter.com/JamesInTime/status/909440267635142656
"Thank you to the first responders,  ,  , friends and good neighbors who are helping to restore Daytona post-Irma",6,09/17/2017,https://twitter.com/rachsloot/status/909430129729970178
"please donate , so I can go down to Fl & help! I'm a HVAC/R technician! Richkucinskas  gofundme.com/4frnuqw",5,09/17/2017,https://twitter.com/UAlocal597/status/909429522180734977
"We can deal with the flooding. Look at the money spent on supplies due to no power/air/refrigerator/freezer, losing food…all that crap!",2,09/17/2017,https://twitter.com/UK88TL/status/909424411102662657
"By the way, up here in Michigan our subdivision is all underground and we still lose power in bad storms.",5,09/17/2017,https://twitter.com/oljscott58/status/909424344794910720
Oh so it was a coincidence that a hurricane came through around the same time that you lost power...... #crazycoincidence ,1,09/17/2017,https://twitter.com/barrett812/status/909424277614731264
Underground would definitely help with some wind problems but not with flooding.,1,09/17/2017,https://twitter.com/oljscott58/status/909423768728145920
how does this happen A WEEK after the storm?!?  what are you people doing?!?!,6,09/17/2017,https://twitter.com/How_bout_hellno/status/909423115565981696
I have absolutely no problem with higher electric rates if it avoids having to deal with hurricanes and losing power year after year!,1,09/17/2017,https://twitter.com/UK88TL/status/909422676418203648
"Still no power,  . It has now been one week and two of your own self-imposed deadlines have come and gone...",2,09/17/2017,https://twitter.com/FL_Divorce/status/909422208132448256
Do you want higher electric rates? Very expensive operation. Even then if it floods the pad mounted transformers would short out.,1,09/17/2017,https://twitter.com/oljscott58/status/909422149009657856
Hey  I have a friend who still doesn't have power on from hurricane Irma. Any help u can provide?,2,09/17/2017,https://twitter.com/JennaCocorullo/status/909412731358507009
 There's a lift station without power on Rosemary Court in Naples. Sharing bc no one has been thru here since the storm.,2,09/17/2017,https://twitter.com/michellemv/status/909411326669279233
The Hollywood nursing home had power as seen on the news with a running fan and tv was on. So much run there not FPL's fault,2,09/17/2017,https://twitter.com/ehoffman_esther/status/909404433704013825
The residents of Coral Gables know better. Stop the lies and have the executives pay sufficient workers.,3,09/17/2017,https://twitter.com/JudithCGolden/status/909403787495985152
"9 days after the hurricane #Irma Pinecrest FL is a ghost town.  ,  and  forgot their residents",2,09/17/2017,https://twitter.com/estebangerbasi/status/909403198334566401
Thank you  and #lineworkers from everywhere who came to help. I have power! Thank you! #irmarecovery #damnhot,6,09/17/2017,https://twitter.com/Amycfernandez/status/909374405687603200
Why don't you find out if gov Scott is gonna replace food stamps for lost food from the hurricane? Please,1,09/17/2017,https://twitter.com/PINKHilliker/status/909357789759209472
Why does my ticket change the number of affected customers from 1600 to 43 to 1582 to 9 to 41? Only accurate info is no power,2,09/17/2017,https://twitter.com/stevefilter86/status/909299570781323264
33168 day 8 no power down line in my backyard +elderly parents +heat =disaster on top that I am already such HELP US in Nw north Miami 125th,2,09/17/2017,https://twitter.com/mslilbitsworld/status/909291021929975809
I propose that  sanction  for not being prepared for #hurricaneirma2017 fpl should pay those who have been without power  twitter.com/sleepapneabook /status/909287961950347264 …,1,09/17/2017,https://twitter.com/goldstocktrades/status/909289796316663808
"FPL should have been prepared 4 a cat1 storm. There is no reason to have to report the same ""line down"" outage 4 times. No power - day 8!",1,09/17/2017,https://twitter.com/imjustsayin2/status/909282711948361729
 This is completely ridiculous. How do  residents file an official complaint against  ? ,1,09/17/2017,https://twitter.com/iloverickgrimes/status/909280036016009216
" day 7 in Aventura,  doesn’t care as none of the emergency lights/exit signs are working. Fire violation!  ",6,09/17/2017,https://twitter.com/HouzConsulting/status/909278207026892800
" , good thing your computer systems know how to do automatic updates when deadlines pass... #FPLOutage #getittogether ",1,09/17/2017,https://twitter.com/FL_Divorce/status/909268159626084353
I'm a nurse and during the storm I left my family to go help with shelter situation but I've been without power for 7days according,2,09/16/2017,https://twitter.com/futurePA2020/status/909261389411373057
"yes but people expect them to turn EVERYONE'S power back in 1,2,3! #ungreatful w/ other hurricanes we've had to wait wks & wks #smh",6,09/16/2017,https://twitter.com/Mnkygrl0384/status/909257746977091584
 thank y'all so darn much for everything your team did after hurricane #Irma fast recovery time and go grind effort no stop thanks,7,09/16/2017,https://twitter.com/marleyjurnt/status/909255588722462721
"Oh boy, I'm so sorry you still don't have power! Was there that much damage in your area?",5,09/16/2017,https://twitter.com/KLinFL/status/909253043601977346
 transformer and power lines done. Fpl has yet assessed the situation. Wondering how can crew see damage if pole is on ground. ,7,09/16/2017,https://twitter.com/Agutz86/status/909250376939040768
Thank you for preparing my grid for the upcoming hurricane. Glad the map period is so updated so I may get accurate information. ,6,09/16/2017,https://twitter.com/DeepGreen07/status/909246389598769153
Now they say Monday at 11:45 this is crazy..no wonder why so many elderly people died in Hollywood. I've yet to see one FPL truck out.,2,09/16/2017,https://twitter.com/danilynnx/status/909241760832016384
Don't attack the lineman. Attack FPL the monopoly.,3,09/16/2017,https://twitter.com/kjlamborn/status/909232455785353216
I believe they have. I've seen other trucks driving around in fleets. I guess the job is still massive.  wasn't ready!,1,09/16/2017,https://twitter.com/SheSquirtsInk/status/909231986170089472
   While safety and efficiency #1 why 1 man sleep under the truck and this group laughing on break ,2,09/16/2017,https://twitter.com/Evacsax/status/909231977164926976
Crowdsourcing of self-serving exploitive politicians during a crisis has put you at top of list,3,09/16/2017,https://twitter.com/crespogram/status/909231105601044480
 Recloser  5 6715 4095 off/damaged. Bypass switches not engaged. Please check.,4,09/16/2017,https://twitter.com/EpicZazzmatazz/status/909229488436891648
 is it a conflict of interest to have an emergency restoration agreement with  ? I believe they buy from you all.,2,09/16/2017,https://twitter.com/BurntTurkey69/status/909227860673617920
Yeah nice words! But  needs to get their sh*t together. It was barely a cat 1 storm winds we got!,1,09/16/2017,https://twitter.com/rudimuss/status/909225993713438720
"Is there any reason  cannot be bothered to give their customers, your residents and voters, reasonable updates on their power?",1,09/16/2017,https://twitter.com/therealdeadball/status/909223626993537024
 - Thank you to those workers who came at 230am and restored our services- the heat affected my elderly mom with Alz/Dementia TY,6,09/16/2017,https://twitter.com/maid4hack/status/909222873818157056
"I understand, but I traced lines2 substatn & no major damage. Mstly droppd fuses. Can isol8 major problms.Happens every time powr goes out!",1,09/16/2017,https://twitter.com/K1er/status/909219720393580544
When will North Merritt island get pumped down?canal is still flowing into my backyard. Many homes still flooded.We need help. Mosquitoes,2,09/16/2017,https://twitter.com/ctesta2009/status/909214574343270400
 storm ticket number 5176 in progress I doubt it no changes to status at all!,2,09/16/2017,https://twitter.com/sarahedw/status/909212673887342592
Thnx however our power has been going out when a slight breeze blows for at least a decade. I've reported it to  dozens of times,1,09/16/2017,https://twitter.com/ellenwidom/status/909207270109696000
You just extended your deadline which makes this an outright lie! Where are all these workers?33157,2,09/16/2017,https://twitter.com/jeromeeppinger/status/909204663513309184
Hey  you guys are a sack of increment with your lies of being prepared for this storm.,1,09/16/2017,https://twitter.com/mikejets5/status/909203919712202752
Thanks to Steve and Canadian E&E Powerline for assisting  with the recovery in SoFla. You guys were great! #LetThereBeLight ,6,09/16/2017,https://twitter.com/yayoheems/status/909202558446718977
That company  was never hurricane ready as they claimed. They have no plan/process in place. 8 days no power. ,1,09/16/2017,https://twitter.com/tellyathis/status/909200902988410880
Many residents have begun to resume normalcy as power is restored. A special thanks is in order for those workers who make it all possible!!,6,09/16/2017,https://twitter.com/GlenMey23025145/status/909199162671067143
So who do I have to bribe at #FPL to get my power back up. We know y'all are crooked. #sevendays #hurricaneirma ,3,09/16/2017,https://twitter.com/titohax/status/909196332056895490
"Um, just no. #fuckirma #fuckmaria #fucklee when the fuck is #hurricaneseason over?!? #stillnopower  ",2,09/16/2017,https://twitter.com/Jujubean305/status/909193964472995840
 OMG! Power out again! WTh! The storm is long gone! Fix your infrastructure!,2,09/16/2017,https://twitter.com/ChildsRt2BOk/status/909193958328324096
"Thanks for restoring my power so quickly! I can see the improvements since Willma. You guys had the crew in FL before the storm hit, thanks!",6,09/16/2017,https://twitter.com/jw019/status/909192745461444608
5/4 We need to expand our ratebase and thus will continue to rebuild with inferior infrastructure that will topple during tropical storms,7,09/16/2017,https://twitter.com/yannbrandt/status/909192558840033281
FPL is the greatest. After the devistation from this storm. They are doing an amazing job. Thanks to everyone. It is truly appreciated,6,09/16/2017,https://twitter.com/LarryCWS/status/909191602274521088
   This is not acceptable. Florida should have a setup in place for this issue Since known 4 hurricanes,1,09/16/2017,https://twitter.com/Evacsax/status/909190009504321537
... the proper equipment. Restoration begun 3 days ago for our storm ticket. They leave the job halfway done to then leave me for last?!,7,09/16/2017,https://twitter.com/Its_LidiBaybayy/status/909183632677449728
Thank you for the update! I can see FPL contractors & vehicles are working very hard! FPL deadline is approaching soon 9/17 ,6,09/16/2017,https://twitter.com/scireith1/status/909182483081551872
 did you ask  for explanation for why they were so ill prepared for a hurricane that wasn't even direct hit?,1,09/16/2017,https://twitter.com/Rsp94395407/status/909177407491452928
Again a generic mg that does not address anything nor shows you read that theissue was reported prior to the hurricane. Sat ,1,09/16/2017,https://twitter.com/Evacsax/status/909175818793996288
" numbers as of 6pm: 18,200 accounts affected, 13,080 restored, and 5,120 still out. FPL making steady progress on restoration. ",8,09/16/2017,https://twitter.com/CityNMB/status/909175632805945344
 It has been almost a week since cable down reported many times. Worried about our safety. Does anyone care? Power around us too.,1,09/16/2017,https://twitter.com/ohap33/status/909174222764863489
"I have called many times about a cable down on my property to no avail. The entire neighborhood has power, except us. It is a safety hazard.",2,09/16/2017,https://twitter.com/ohap33/status/909173671981445120
Keely Drive has been without power for 7 days. There's really no excuse since we were one of the least damaged areas. Why??????????,2,09/16/2017,https://twitter.com/Kelly10230318/status/909172410699665409
 Keely Drive has been without power for 7 days. There's really no excuse since we were one of the least damaged areas. Why????????,2,09/16/2017,https://twitter.com/Kelly10230318/status/909172276637179905
Keely Drive has been without power for 7 days. There's really no excuse since we were one of the least damaged areas. Why??????????,2,09/16/2017,https://twitter.com/Kelly10230318/status/909172126913040384
"This is my sentiment, our equipment was clearly neglected/poorly prepared for hurricanes. There's a tree in every power line.",1,09/16/2017,https://twitter.com/adrymustdie/status/909169912001769472
 tentatively will b 8 days w/o power w Irma versus 12 w Wilma. Yet 4 past 12 yrs u have tacked on a hurricane surcharge 4 what? ,2,09/16/2017,https://twitter.com/Michael62200340/status/909167003528826881
.  : we know where the outages are but in most cases we don't know the extent of damage until we lay eyes on it.  ,2,09/16/2017,https://twitter.com/silvaharapetian/status/909157993555615744
How about now do you have power I sure hope so prayers your way,5,09/16/2017,https://twitter.com/RealityJunkie33/status/909157584019398656
"At least you've seen trucks. We have only seen 1 or 2 in the entire neighborhood, and it's been a week since the storm passed",2,09/16/2017,https://twitter.com/MSL82200/status/909154751375437824
" Ticket #5041 says 4 affected. At least 35 houses without power, not 4. Pls investigate. NE19th Street  Drive",2,09/16/2017,https://twitter.com/GatorEMS/status/909151086426157056
"Question: after recovery of power, Can FPL remove all the vegetation, not trim, that will impede power recovery in future regardless of area",6,09/16/2017,https://twitter.com/Its_my_opinion2/status/909147606064001031
"Fpl , Dade County and Pinecrest never learned from Andrew ,Wilma and Katrina what have we done ? Need better technology for hurricanes",1,09/16/2017,https://twitter.com/RobertPuig8/status/909146257305808907
 ... wondering why getting the trees cut in the park are more important than restoring power to residents #7buildingson15thstreet,2,09/16/2017,https://twitter.com/veronicadeleo/status/909144946606735362
 not considered an emergency unless you are rich? #FPLOutage #FPLproblems ,3,09/16/2017,https://twitter.com/Bakencraft/status/909144624274591746
With    sharing the numerous concerns and complaints from area residents with   – bei Maruch Restaurant,1,09/16/2017,https://twitter.com/CommBovo/status/909139864687448065
Dear  ...how unprepared were we for this storm? Coral Gables still waiting and now delaying restoration?,1,09/16/2017,https://twitter.com/c_ferriter/status/909137790323044352
"Home, and everything is OK here. Younger daughter had damage at her home, but everyone safe! <3",5,09/16/2017,https://twitter.com/Write2Steph/status/909136835720425473
"Palm Gardens on 57th Ave & 190th. The storm ticket has been ""in progress"" for over 48hrs. The community has power except my side of the bldg",2,09/16/2017,https://twitter.com/Its_LidiBaybayy/status/909136735434690560
 my power didn't go out till 1030 Sun night but the storm ticket say 530 maybe fpl should drive here and check y i have no power,2,09/16/2017,https://twitter.com/ohboy9/status/909135429609369600
 hasn't even driven thru our neighborhood. We were w/o power 12-14-14 days in '04 & '05 hurricanes. FP&L lies about restoration %  twitter.com/HeraldTribune/ status/909075353322315777 …,2,09/16/2017,https://twitter.com/LiveFreeorDie3/status/909135197823696896
It is time miami dade mandated buried power lines,1,09/16/2017,https://twitter.com/doctorvmr/status/909134994278424576
 its #deathly hot. What are we waiting for? #hot #FPLSUCKS #yourplanisnotworking ,7,09/16/2017,https://twitter.com/realjturtle03/status/909134336531861506
7th day w/o power in 33015 while neighbors have power. We only had tropical storm impact! The heats unbearable! UNACCEPTABLE! #HELP #INHUMAN,2,09/16/2017,https://twitter.com/Its_LidiBaybayy/status/909133147937415168
Looks like  working to restore power to FIL's mobile home park Southern Pines in Bonita Springs. Only road in/out still flooded. ,6,09/16/2017,https://twitter.com/TampaBayGary/status/909128412278771713
 should follow  who restored power to 95% of island within 2 days of hurricane. What happened to $200+ bill pays?,1,09/16/2017,https://twitter.com/SLFINANCIAL/status/909128190773297154
Criticizing the state infrastructure with being an ungrateful mooch or attacking  line workers.,8,09/16/2017,https://twitter.com/eleebeck/status/909127274871627776
"Also  the storm cut off our power as it happened, not several days later. Your ticket creation date is a straight up lie.",7,09/16/2017,https://twitter.com/JennyLeah331/status/909126613434019840
7th day with no power in 33015 while all my neighbors have power! We only had a tropical storm impact! INHUMAN and UNACCEPTABLE! #HELP,2,09/16/2017,https://twitter.com/Its_LidiBaybayy/status/909126084880486402
Sunset Palms Elementary students thank FPL for restoring our power quickly after the hurricane.  ,6,09/16/2017,https://twitter.com/Principal_SPES/status/909125883918798850
"Cannot be considered more than a joke from  and  again here in zip 33907 there was mayor damages, is this real? 3/3  twitter.com/FLSERT/status/ 909083359606951936 …",2,09/16/2017,https://twitter.com/a_matar/status/909125868206936070
My backyard and backdoor are not safe and 7 days after storm I still have not been told when FPL will cut these branches. ,2,09/16/2017,https://twitter.com/skilo1557/status/909125754402824192
7th day of no power while ALL my neighbors have power! We had tropical storm impact! This is UNACCEPTABLE!,2,09/16/2017,https://twitter.com/Its_LidiBaybayy/status/909125426353713152
Or tornados in your area and the fact that you have not seen even one  team around your neighborhood? I am sorry but this 2/3  twitter.com/FLSERT/status/ 909083359606951936 …,5,09/16/2017,https://twitter.com/a_matar/status/909125342853582848
Day 6 without power. #PompanoBeach also water damage. Can't operate fans or dehumidifier. #mold #ThanksIrma  ,2,09/16/2017,https://twitter.com/JeffMartinMedia/status/909125295961239552
We noticed today another exposed wire from a light fixture that was damaged during the storm.,2,09/16/2017,https://twitter.com/KurtBell28/status/909125226784583680
"Day 7 with no power. My storm ticket has been ""in progress"" for 48 hrs and not a single truck in sight! UNACCEPTABLE!",2,09/16/2017,https://twitter.com/Its_LidiBaybayy/status/909125025139130368
"7 days after storm,can u tell me,when will you cut the tree hanging on my power line and blocking my back door?",2,09/16/2017,https://twitter.com/skilo1557/status/909122653377695744
 admirable cleaning crews.  on the contrary shamefully absent from Upper East Side. #hurricaneirma,6,09/16/2017,https://twitter.com/chicfbdotcom/status/909121064319508480
 you guys said my power would be restored on the 17th. Changed it to the 15th and havent made the deadline. Stop playing games.,2,09/16/2017,https://twitter.com/engels_tova/status/909120890302066688
Meeting w/  re: remaining power outages in Miami-Dade. Thank you to all crews+volunteers working in #OurCounty for #IrmaCleanUp . ,6,09/16/2017,https://twitter.com/CommBovo/status/909120878402732033
 How come a single storm -in a hurricane prone state- overwhelmed the main energy provider in the state of Florida the way it did?,1,09/16/2017,https://twitter.com/the_morning_owl/status/909119157257502721
Good enough?  there's a few zip codes as 33907 & 33919 where there was not flooding or tornados & we're still the last 2/2,2,09/16/2017,https://twitter.com/a_matar/status/909117823728914434
"It's the final stretch with no power according to  , y'all stay strong south Florida fam",5,09/16/2017,https://twitter.com/RoseBloomin/status/909117724709785601
We are on residential street (33143 High Pines) & ticket says 5 customers affected. Crews came Wed helped a few homes & left. Since then zip,4,09/16/2017,https://twitter.com/dansac/status/909116366971654144
 Hurricane Irma did not cause as much frustration as the FPL did...the real aftermath,3,09/16/2017,https://twitter.com/the_morning_owl/status/909114376988356608
"So by the time  restores everyone's power, another storm will come and knock it out. Fucking great.",2,09/16/2017,https://twitter.com/Tweetybird0963t/status/909111477398892544
